rating,review
2 star rating,"The history of the Chrysler House building that Dime Store is in represents a nod to its past where the building was occupied by the Dime Savings Bank and you could open an account with only a dime. When you first enter Dime Store, it maintains Detroit's hip, grungy modern vibe with exposed brick as a tribute to industrial design. I had the Duck Bop Hash (~$12) which was absolutely delicious! Visiting from out of town LA, the price can't be beat and there was a generous portion of duck. When the waiter came out to serve me, I realized this dish was very Korean fusion brunch with english muffins, runny eggs, pickled veggies, and duck. The flavoring of the duck is drool-worthy, with a nice tang of spiciness and is extremely packed with taste! It also came with a side of jam which made it a great combo of spicy and sweet atop cubed potatoes. I would recommend all visitors to come try. Sadly, does not accept Apply Pay."
5 star rating,"Stepped in here during a hectic morning - had 20 minutes for breakfast and this place delivered. Funky small diner-like spot nestled in downtown. Sat at counter and service was fast yet congenial. The special was a chicken bbq hash with poached egg and creamed corn. My god it was good - tremendous combo of flavors and I loved the interplay of bbq, corn, broccoli rabe, sweet potato and onion . Biscuit was also solid and coffee was strong and perfect .Highly recommend!"
5 star rating,"Duck Bop Hash sweet and spicy.  English muffin stale for my taste...I'm sure others let it soak in Strawberry jam, not me.  Potatoes cubed, need to soak too.  The Duck, egg and veggies- great.  Sat at the counter by myself while hard working women and men only had a moment to glance up to acknowledge my close presence on the other side of a glass separating counter.  Loved the atmosphere."
4 star rating,"Only visited twice, but I must say I'll definitely be back again. I love their brunch and the Korean fusion they offer like Korean fries and the duck bop hash. I always have to order the pork rinds each time I visit too. Another item I highly recommend is their seared Brussel sprouts.I've only gotten cocktails once so far, breakfast old fashioned and a Bloody Mary. Both were well made.Its a very busy restaurant and the location is a bit small. Be prepared to wait an hour minimum if you're coming for brunch on the weekends."
4 star rating,Worth finding parking to get here. Cool ambiance. Decor inside is edgy and creative. Beermosa and mimosa hit the spot. Staff is very friendly and helpful. Food was fire. Spicy Benedicts were awesome.. pork belly was delicious. Chef special kung pao chicken hash was also great. I hope to be coming back again soon. This place was WELL worth the drive into downtown for two not from Detroit Detroiters.
5 star rating,"The food here is so so good! I can proudly say that I'd try just about anything on the menu. It's that good. It's downtown location it's convenient. I've gone twice now with friends. I wouldn't recommend large groups of people because the restaurant is tiny and intimate. Due to this, there's been a small wait each time I've gone to the restaurant. The prices are affordable, especially for the the type of food that's served. I've only gone for brunch so I'm not quite sure rather or not they serve dinner foods. Credit cards and cash are both accepted. The restaurant does not have parking available. I had to find street parking and walk."
4.5 star rating,"Stepped in here during a hectic morning - had 20 minutes for breakfast and this place delivered. Funky small diner-like spot nestled in downtown. Sat at counter and service was fast yet congenial. The special was a chicken bbq hash with poached egg and creamed corn. My god it was good - tremendous combo of flavors and I loved the interplay of bbq, corn, broccoli rabe, sweet potato and onion . Biscuit was also solid and coffee was strong and perfect .Highly recommend!"
5 star rating,"Brilliant! Great service, friendly, and delicious! We went for breakfast (but a bit later in the morning because this place can get busy) and everyone enjoyed the flavors and atmosphere. Definitely an attraction in downtown Detroit!"
5 star rating,"Expect a long wait time but worth the wait. It's a cozy place small but fast pace.Great service and the food is delicious don't forget to get biscuits. I went with the cold brew, French toast and side of turkey sausage. They also have local beer that I was able to indulge. Breakfast done right"
5 star rating,"Soooo gooood. Sooooo smallllll. Sooooo bussssssy. Once we got in the door, service is quick and courteous. It's pretty cramped, so don't expect to have an intimate conversation, but you can expect opportunity to people watch and eavesdrop! I had a duck confit dish with pickled veg, and a nice jammy red sangria. It was absolutely perrrrrfect."
4 star rating,"After trying to eat here for what seems like forever...we finally had breakfast here and it was awesome! Loved there daily specials: a Korean bbq chicken thigh, slaw, hash and (we requested) soft scrambled eggs. It's was . The strawberry French toast was perfect. A thick cut bread that was perfectly cooked, a little custardy but not mushy"
5 star rating,"Popular for a good reason. The food is fantastic, well prepared and unique. Service is fast yet friendly and relaxed, which means that nobody is rushing you. The interiors are also unique, with quirky art. The duck bop hash is my favorite but there are chef specials that don't disappoint either. They also serve Zingerman's coffee and have lots of drink options for brunch. It is small though and they don't take reservations so be prepared to wait unless you come when it opens (8am)."
5 star rating,Good vibes and atmosphere. Food was great highly recommend the strawberry French toast.
4 star rating,"The food is delicious. Love the duck bop and cold brew coffee with chocolate. I would say it is more like American Asian fusion. Very modern nice and city like interior design. I feel like I'm eating my brunch in New York. Very nice location, there is a garage parking right across the restaurant, and there is e-scooter everywhere that you can download the app and take the scooter to the river where you can see the Canada."
5 star rating,"I had high hopes for this place especially since I waited twice for over an hour to eat here. I was disappointed. I had the Croque Madame Benny and was not impressed, the potatoes were completely cold and the Benny had very little flavor. The Mac n cheese tasted like a bad version of boxed Mac and cheese and the truffle fries were very thick cut which I'm not a fan of, and soggy. The blueberry French toast was the best part of the meal and it was sub par. I would recommend trying this place out if you're a mediocre foodie but for me, it just didn't satisfy any of my ""tooth's"" and was just okay."
2 star rating,Highly recommended.  Great food. Great staff. Great atmosphere. I have not been disappointed with the quality/perception/taste of the food; I went outside my comfort zone and tried multiple dishes and they were all delicious. Only down side is the wait - which typically means the food is excellent.
4.5 star rating,I had breakfast here this past weekend. I am from NYC-I saw good reviews - and was not disappointed! Got there early so luckily no wait. Very good experience & friendly server. Best truffle fries ever!
5 star rating,"Best salmon salad I can remember in a long time. Salmon made with a maple glaze that's out of this world. Great staff, from the hostess, to the waitress and the cooks. Came on a Friday after the lunch crowd and got right in."
5 star rating,Theres a wait for a reason people. This place is out of the park for brunching. Amazing food and great drinks!
5 star rating,"I'll be quick: the coffee was a huge disappointment. It was weak and flavorless.  We actually sent t back and ordered the nitro cold brew, thinking that would surely provide the taste and power we seek.  It was definitely better than the drip coffee, but still lacked ""oomph"".  The food was good but also didn't knock my wig back.  Service was excellent. We come to Detroit often and know all the best spots around the city from our own explorations over the years, and our connections.  So we were excited to try this new spot that's been getting rave reviews.  I wish I could give a higher rating, but the coffee definitely killed it."
3 star rating,"Solid breakfast, as the reviews suggest. I had the pork sausage breakfast sandwich and it was good. Ask for a side of the apricot jam and put some of that on it. I love when breakfast comes with greens on the side. These were a little salty, but still okay.My dad built his own omelette with bacon, onions, green peppers and goat cheese. Goat cheese in an omelette is the move. The server accidentally mixed up my parents' omelettes at first and when my mom had to swap my dad's goat cheese omelette for her own veggie one, she was a little sad. I would be interested in trying the pork belly benny or the duck bop hash and any other day I would have. I was in characteristically in the mood for a breakfast sandwich that day - no regrets."
4 star rating,"Took my daughter here ,had an amazing experience really enjoyed everything She is vegetarian sometimes hard to please but found some stuff she loved and I did as well ,peach mimosas taste great ,awesome brunch place ! Well done !server/bartender was Kari nice gal!"
5 star rating,Special. Spicy pollo loco hash. Coffee.Zingerman's coffee. Great special. Cool atmosphere. Great service. Great addition to downtown Detroit!
5 star rating,"The Dime store is Deff top of the list for breakfast places in Detroit. I have tried the omelets the breakfast sandwiches, but the Benny's take the cake. Today on special was the croque madame and it was nothing short of delicious. Each bite leaves you wanting more with wishful thinking of being able to make the plate at home (probably impossible). I have never had a cold brew prior to the here, but the hype of nitrogen cold brew isn't just a hype.  I can't leave out the great staff! Everyone is so kind and helpful and just seem happy to be here. We have had Chrissy at our very first visit and DJ at our most recent; both a pleasure.  So.....If you're in the area of downtown Detroit even for a few hours, even if it's not ""breakfast"" time, I STRONGLY suggest paying a visit! You will not regret!"
5 star rating,"A few months ago, I stopped in for a coffee and cookie. It was an oatmeal cookie with cranberries and some other stuff I can't remember, but honestly, it was the best store bought cookie I have ever had! I finally tried a meal at this place after months of saying I would. I got the bacon avocado omelette. A bit pricey at $12 and change for carry out, but the ingredients were quality and worth it. The bacon in the omelette was crispy, plentiful, and flavorful. The cheese was delicious too. And they didn't skimp on the avocado. I got the multigrain ""toast."" I found it odd that it wasn't toasted, I'll request that next time. The house fries were good, nice and crispy."
5 star rating,"I've been tempted through their Facebook images for awhile and finally made my way to their restaurant. My only disappointment is that I hadn't stopped in there sooner!The restaurant space is on the smaller side, but quite inline with a brunch location. The place is exceedingly popular, so expect a small wait to be seated. Smaller groups will find space first. Don't pass up on bar seating -- still fun up there and the bartender was a delight to speak with today. Once inside...this place is hoppin! All the waitstaff were incredibly friendly and had smiles on their face despite it being near the end of a very busy day. I was also impressed with the cook staff wearing beard nets -- thanks guys!The food...oh the food was worth the wait. Our waiter directed our attention to the chef specials menu and we chose two meals from it; Croque Madame Benny and Blueberry Cobbler French toast    The eggs for the Benny were poached nicely and the hollandaise was delicious. The French toast well prepared -- not overly sweet, but sweet enough not to require syrup. Before I knew it...I'd eaten the entire plate. Looking forward to making another trek down there and trying something else on the menu. Thanks, Dime Store, for rounding out my afternoon out of the house!"
4.5 star rating,"I got the spicy belly benny which I thought was unique to use pork belly but the meat was a little bland. Also the poached egg was cooked too long. The service is friendly and the interiors are unique. It's a cute shop, but food wise it was only okay for me personally"
3 star rating,"I've been to the Dime Store a couple of times now and have been impressed each time.  Fries are legit, they are accommodating for substitutions (vegan and veg options available) and the staff is friendly. If you can get it, bar seating is probably the best option, especially considering you will probably have to wait for a table (you absolutely will have to wait for brunch). Downfalls are the paid parking and wait times, but if you pop into Bon Bon Bon the wait goes by quickly."
5 star rating,"Savory Brunch at its best!!!  Sure there are a few sweet choices, but with all the savory bites to choose from it didn't break my heart to pass them up!We stopped in this past Saturday (during auto show weekend, eek.), we were not downtown for the auto show, but apparently everyone else was.  We waited about 30 min for a table which wasn't bad.  We waited for our food for about 40 min.  Which is a wait, but they were really busy so we could understand.  I had (at my servers suggestion) the Cheesesteak Benny.  Marvelous!!!  Ah geez, it was so good!  Super tender steak, sweet onions, and american cheese with a poached egg that all gets coated in a velvety hollandase sauce! The hollandase was great!!  Served with a small green salad that was light and refreshing.My husband has the Duck Ruben.  The toast was nice and thick, loaded with duck.  He really enjoyed it.  The hand cut steak fries were very tasty too!My friend had the Korean BBQ sandwich.  It was incredible!  The sauce was nice and tangy!Beer selection was really good.  Service was very nice.  It was really busy and everyone seemed to be helping each other out.  Always nice to see that among a team!"
5 star rating,Get the SPICY BELLY BENNY! It's literally pork belly eggs benedict. It's got this nice pesto flavor that complements the pork belly. That pork belly is cooked so well that IT MELTS IN YOUR MOUTH! There is a line so expect to wait an hour. Eat a snack before you go. You might just want to go when they open. But it is worth the wait!
4 star rating,Duck hash and keylime french toast was delicious.  Nice space and good atmosphere.  Hit some bikes and did a quick spin around the area after.  Dont miss the guardian building and a show at the fox.
5 star rating,Enjoyed the most fabulous confit duck bop hash at this equally fabulous gem of a place to dine. Wow!
5 star rating,"This brunch place is a favorite of mine in downtown Detroit. They do offer validated parking, so be sure to take advantage of that as parking can sometimes be difficult. We ordered the spicy korean fries as an appetizer, and I highly recommend it! It has the perfect blend of sweet and salty. We weren't too impressed by the spicy pork belly benny because the pork belly was lacking in flavor and was very dry. However, my duck bop hash was delicious! The radish on top, similar to the sweet radish that a lot of Vietnamese food has in their bahn mi or Bun, was a great compliment to the duck. It is definitely a must try for any first-time goers."
4 star rating,"The food here sounds better than it is but it is good. What really makes the place is the staff, each of whom is unique but they are all enthusiastic and genuinely interested in your having a good time. We had the pork rinds, the bibimbap salad and the cheesesteak. (All the sandwiches can be ordered ""as a salad"" with greens replacing the bread or bun.). Everything we ordered was fresh and well prepared but they didn't knock our socks off.  It doesn't matter when everyone is having fun. This place is worth a detour."
5 star rating,"I've been tempted through their Facebook images for awhile and finally made my way to their restaurant. My only disappointment is that I hadn't stopped in there sooner!The restaurant space is on the smaller side, but quite inline with a brunch location. The place is exceedingly popular, so expect a small wait to be seated. Smaller groups will find space first. Don't pass up on bar seating -- still fun up there and the bartender was a delight to speak with today. Once inside...this place is hoppin! All the waitstaff were incredibly friendly and had smiles on their face despite it being near the end of a very busy day. I was also impressed with the cook staff wearing beard nets -- thanks guys!The food...oh the food was worth the wait. Our waiter directed our attention to the chef specials menu and we chose two meals from it; Croque Madame Benny and Blueberry Cobbler French toast    The eggs for the Benny were poached nicely and the hollandaise was delicious. The French toast well prepared -- not overly sweet, but sweet enough not to require syrup. Before I knew it...I'd eaten the entire plate. Looking forward to making another trek down there and trying something else on the menu. Thanks, Dime Store, for rounding out my afternoon out of the house!"
5 star rating,"Great brunch location. It can get busy so plan accordingly. The menu is full of delicious, fun items and the staff is always on point. They have a great coffee bar too if you need a mid day pick me up. His is always a go to for my friends and I."
4.5 star rating,This is a cute restaurant in Downtown Detroit that serves breakfast and lunch. The apple Caramel bacon French toast was amazing( I didnt get the bacon). The Turkey sausage was the best I have ever had. It was moist and seasoned well. And my over easy eggs were perfect. The coffee was strong but not overbearing on the taste. The staff was friendly and attentive.
5 star rating,My wife and I checked this place out for breakfast in downtown Detroit while we were visiting and loved it! We both got great drinks (coffee old fashioned and beermosa) and had great breakfasts. It was pretty crowded when we went but that did not stop the service from being good. Our waitress quickly greeted us and our drinks and food came quickly too. And they were able to validate our parking for the parking garage that is attached to the building where the restaurant was. Overall and a great experience and will definitely be back to next time we're in Detroit.
5 star rating,"Absolutely fantastic food and service and definitely worth the 45 minute wait for a table. We started with a hot chocolate, mimosa, and bacon, parmesan, and truffle fries that really helped get the appetite going. Highly recommended fries, definitely something to get if you love fatty bacon. For the meal, I got the Spicy Belly Benedict with pork belly and a side salad. The meal is not so spicy that it would upset a hungover stomach, so it's perfect! The eggs were poached to perfection, and the salad was an excellent companion to the fattiness of the pork belly and hollandaise sauce. My friend ordered the biscuits and gravy and eggs--also very delicious and portioned very nicely. If you're looking for a place to take a friend from a bigger city, Dime Store is an excellent place to show off what Detroit really has to offer."
5 star rating,"Great service, nice environment, and my order was an average breakfast dish.  my son ordered a veggie hash, average.  My husband's spicy pork belly benny was very delicious according to him.  P"
4 star rating,"This is a very nice basic classic breakfast restaurant. Service was friendly, coffee and cappuccino was   terrific.  I had the special French toast my guest had a very simple egg breakfast and coffee. Overall good food, strawberry rhubarb French toast was terrific. I was upset I missed the blueberry lavender French toast a few weeks ago. It is kind of loud for a  business meeting but not to bad. They  have a small alcove to hold 6 people for small group too. Only reason it's not a 4 is limited menu. But I did like they give you a parking voucher otherwise parking in the D is difficult and expensive at times."
3 star rating,"NO NEED TO CONTINUE READING, just do yourself a favor & go. The place isn't huge so there's usually a wait to be seated...but it's worth it. I ordered the El Toro Rojo: 2 poached eggs with hollandaise, housemade chorizo, tortilla strips, white cheddar, salsa roja, & pico de gallo w/a fruit bowl. We also ordered the Spicy Korean Fries  shaved steak, bulgogi, siracha mayo, pickled veggies & a SOFT PARADE BEERMOSA  to wash it all down."
5 star rating,"Ever since the Dime Store was slated to open in Detroit I have been pretty eager to try them. I love a good brunch place.  However there are so many great brunch places I knew they had some stiff competition. I waited off a few months so they could fix some of the new restaurant kinks. I was pleasantly surprised with the atmosphere and food.  We ordered a nice sample. First up, the cauliflower Gruyere soup topped with fried onions.  I thought this was pretty delicious. I would definitely get this again.We had such a hard time deciding if we should get the korean BBQ sandwich, duck hash, or spicy korean fries. They all were relatively the same in ingredients. We landed on the fries... Omg. These guys were so good. I see why people love the korean BBQ sandwich now. The beef and the pickled veggies along with the mayo and other sauce really made this unique. I love fries and this is a definite ""get again"" order. I may even ask for extra beef and veggies and make this a meal. The duck Reuben on rye was huge! It came with pickled cabbage, stone ground mustard and arugula. This was also a winner! Totes worth the price. The one thing is the sandwich didn't come with a side. We ended up ordering the brussel sprouts which are always a good choice. However they weren't good this morning. Being a salt lover I don't usually mind if things are a bit over salted but these were inedible. So we didn't  finish them. We did tell the waitress that they should tell the kitchen. I'm sure once they tasted them they would understand that the balance is off.  We were kind of bummed that we paid for them. No big deal because they were only 4 bucks but added onto the 13 dollar sandwich and it was a 17 dollar meal.Last item we ordered was the sausage hash. I'm going to be completely honest... I'm pretty sure I wouldn't get any of the hashes again.  Pretty tough on breakfast hash. I kind of walked in already knowing this was going to be just an average potato meat mix. It was ok. Nothing to write home about. I think it needed more seasoning or .... ? It just lacked flavor in my opinion. The gentlemen sitting a few seats down from us got the duck hash and it looked good. I'm sure it was since it had some of the same ingredients as the fries. Next time I'll try a Benny! All in all a good experience. Come early! We just made it past the long wait. When we walked out there were tons of people waiting. We got there a few minutes after it opened and almost didn't make the first round of seating.*****Edit*****The message from the business below shows good business practices and an overall want to make the customer experience positive. This is something that many new restaurants lack. I will be back to checkout the other breakfast items, but I'm pretty excited to try more of their sandwiches!"
