rating,review
5 star rating,"One of the best spots downtown for brunch, in my opinion. Great variety of foods, not a menu a mile long to help fuel your indecision or worries of things not being fresh. And a decent selection to make your meals vegetarian or gluten free. It's worth the wait. And you can always curb your hunger or hangover by popping into Drought for some delicious cold pressed juices and shots, or Bon Bon Bon for some sweets."
5 star rating,"The hype is real! This place is delicious and worth the wait. Had a breakfast sandwich and waffles for the table and all were great. Especially the turkey sausage sandwich- one of the best I've ever had. Plus the server was SO nice, I wish I had her name to complement her. Great food and great service = five stars! I'll be back."
4.5 star rating,"While in Detroit a friend and I decided to check out Dime and let me just say that I was very impressed! Although it was very busy, my friend and I got seated right away! The menu was overwhelming in the best of ways, the options were endless and the dishes were anything but ordinary. The flavors were so complex and delightful and clearly made with care. The ingredients were very fresh and the fruit bowl was out of this world! If you are looking for a place that has brilliant flavors and a fun upbeat atmosphere, then Dime is the place for you."
5 star rating,"Awesome menu, had so many things I wanted but unfortunately only have 1 stomach to fit it all. It's a busy place so be prepared to wait a bit for a table. Luckily they are in the Chrysler house building and you can wait comfortably in the lobby."
5 star rating,"Duck confit, thick chunks of smokey bacon and buttery hash topped with a sunny side egg..need I say more? Needless, to say this tastes heavenly! I also sampled their salad with grilled chicken breast. The chicken was a little on the dry side but well seasoned and the dressing was quite good. The multigrain bread was very good; pillowy, slight chew and the taste of the grains really pull through.Their coffee on the other hand....was extremely disappointing. They touted the fact that it's locally roasted by one of the indie roasters but it was quite stale. It lacked body, very acidic and sour. As a coffee guru myself I am just gravely disappointed to say the least. I glanced over at the other tables briefly and barely anyone drank their coffee and definitely refills are rarely seen.A must visit for the mostly great food but skip the coffee and opt for a juice or something instead. Hopefully, they will read this and work on improving their coffee!"
4 star rating,This place is unbelievable. The food is incredible. The tastes are unique and so full of flavor. It's one of those times you eat and you feel like this is exactly how I should feel to start the day. Run! don't walk and check this place out.
5 star rating,"Food was delicious.  We walked in about 9am and were seated promptly by the window.  I loved how creative their food was, and the flavor did not disappoint.  Great food, nice restaurant, attentative waitress."
4 star rating,"Great breakfast!  the food, location and atmosphere was very memorable.  I would absolutely eat here again.  The truffle fries were yums, but I love their strawberry jelly."
5 star rating,"A little pricey, but super delicious for a special breakfast or lunch! The smoked salmon Benedict was fantastic and their coffee is very good! Will be back."
4 star rating,Best brunch in Detroit.  Often themed and always good.  The red wedding is my favorite thus far.
5 star rating,"The food was good and the ambiance was interesting. I had an omelet, my only complaint about it was that they do not have feta cheese. I prefer eating eggs with potatoes, but I was disappointed to learn that pork belly is fried in the same fryer as the fries and breakfast potatoes! I'm a vegetarian and this is the first I've heard of a restaurant not cooking the meat separately. I asked if the potatoes could be cooked separately, but I was told it wasn't possible. That left a bad taste in my mouth. The restaurant needs to be more cognizant of vegetarians and other non/pork eaters."
3 star rating,"Wow, what a great place to have brunch in downtown Detroit. Came here for the Ex-presso yourself french toast, and fell in love with the whole menu. I ordered the chief's special roots rock omelette, and it was spectacular. The beef was cooked and marinated just right and the beet puree combined with the mushrooms created a harmonious and delightful taste. The expresso yourself french toast was just as good as it looked. Also their coffee (Zingerman's) was brewed perfectly. The atmosphere and service was great and I would highly recommend it (already have)."
4.5 star rating,"This is one of my favorite places to get breakfast. They serve Zingerman's coffee, which to me is the coffee of the gods. I've only been here twice, but have always gotten the duck bop hash. I'm too chickenshit to try anything else because the duck bop hash is just too amazing and I'm afraid another dish won't compare to how delectable it is. I'd highly recommend this place on a weekday, as the wait times would be shorter. But they've got these things called chairs outside the place that you can sit your impatient bum on, so... No excuses. Try this place out!"
5 star rating,"The food is great. Eggs Benedict are A1, so is the cauliflower cheddar soup. Sit at the bar and talk to Mike the bartender, fun guy."
5 star rating,"We Had breakfast here, great food, hip atmosphere, get one of the Bennies. We had the cheesesteak Benny, it was surprisingly good, order came out in like 15 min despite being super crowded. Would definitely come here again."
5 star rating,"Love the atmosphere, food and service.  Menu is unique and elegant, but not priced that way.  Very affordable.  Bistro-style dining on a dime!  :-)"
5 star rating,"After having spent some time in Brooklyn, this place took me back to that atmosphere.  Hipster, gentrified, great food pretty much sums it up.  They make a sick beermosa with the Grapefruit Sculpin beer and their duck bop hash is not to be missed.  Great mix of sweet with that distinct duck flavor.  Pokemon Go nerd alert: there's a bunch of Pokestops nearby as well as a Drowzee nest."
5 star rating,Great food and service!!! The place was very busy when we came in but we were able to get seated very quickly still.
5 star rating,"The food is amazing!! Philly cheese steak eggs ""benny"" is rocking my world. Dont pass up the truffle fries either!"
5 star rating,"Delicious! Excellent food, friendly service.  Will definitely come back here next time I am in Detroit"
5 star rating,"I really don't yelp often, though, must say, this place is BAD ASS! Great food, amazing service, left very full & very happy! #bacon#omlette#goathash#biscitsandgravy!"
5 star rating,Came here for a brunch before my flight and I ordered the Duck Bop Hash and I did not enjoy it.  The duck in the bbq sauce was way too sweet and did not go well with the hash which i wanted to be good but it was drenched in the bbq sauce I couldn't get the sweetness out of my mouth.  Sweet and savory overkill.
4.5 star rating,"Lured in by the reviews and the online menu, we rolled in here on a Saturday morning after a concert the night before. We were underwhelmed with everything.  Two of us got the spicy belly bennies, a spin on eggs Benedict that looked promising. Poached eggs with a slice of pork belly and some jalapeño pesto on a biscuit sounded clever and tasty. Unfortunately the execution left much to be desired.  The biscuit was nice. But the pork belly was dry and overcooked. The eggs were probably slightly overdone, but that didn't bother me. The breakfast potatoes looked like they may have been frozen - but in any event lacked any flavor and were a bit hard. The place has a fun vibe but wasn't worth our time or the $."
3 star rating,"From the start of sipping my first latte here, I was ready to love The Dime Store. Lovely location and excellent creative menu that captivated both my boyfriend and I. As other reviewers have noted, a wait can be expected on weekends and holidays. We tried the truffle/parm/bacon fries, Mac and cheese, eggs, turkey sausage, pork belly blt sandwich. Everything came out hot, delicious, and wanting more. Waitress who was helping us was pleasant and attentive. So why the three star review? Customer service. We witnessed a couple next to us receive pretty lousy treatment over an issue with the food. I am a frequent diner of all the new exciting places in Detroit, and customer service is SO important. It was uncomfortable watching the situation play out and it seemed like there could have been a more simple way of handling it all. FYI, customer stated that her meat seemed undercooked and the waitress was not only disagreeing with the diner, but took a while to offer the ""can we make you a new plate""? resolution. As a bystander, the entire situation seemed silly. It could have been addressed more efficiently without losing customers. C'mon guys- I want to love you, but this is so basic!"
3 star rating,"Big Mike at the bar was good peeps. Satisfying brunch spot even with the 30 min wait, which flew by with a quick stroll to coffee and Campus Martius."
4 star rating,This place has a great ambiance to food is excellent and the style of the interior is an excellent mix of raw materials and local art!
5 star rating,"Everything was amazing, swapped sides for biscuit and salad, without a problem.  Wish they were in NY"
5 star rating,Love the local roasted coffee and the better than average portion size plus the food tastes great!!
4 star rating,best breakfast I have had in quite some time!! Had the Sausage Hash and it was delicious and was served a very generous potion I will return for another breakfast in the future!!
4 star rating,"My husband and I have been here several times for brunch, drinks and dinners. We love this place so much that we decided to have our rehearsal dinner here before our wedding. Larry and his staff are so incredibly accommodating and we are still getting rave reviews about our rehearsal dinner. The entire restaurant was ours, the food was absolutely amazing and the bartenders were incredible!Every time we are in Detroit, we make sure to stop by the Dime Store!"
5 star rating,"Great breakfast but the place is so dusty it's hanging from the ceiling! Gross. The food was tasty, but not worth the hour wait. I would suggest it but do some cleaning."
4 star rating,Great food and a fun atmosphere! We had one of the omelettes and with only two eggs it was just the right amount of food!  We also got a side of hollandaise and it was delicious!
5 star rating,"One of the best breakfast spots I've ever been to. Duck bop was amazing. My girlfriends Benedict was done to perfection. Their egg poaching technique is awesome - the eggs come out completely intact with a runny yolk. The coffee is strong and fresh, and the service is fast."
4.5 star rating,"Came for a visit when we were in town overnight. My Bloody Mary was good, nothing too crazy. The Beermosas they serve are also good, never having had one before (they used a local brewed beer, you many have heard of it - Atwater - and it was also a decent price), and I would have to say both of our dishes were very tasty but I expected a bit more I guess after reading their menu. We both picked a dish that was on their chef features. The service was awesome and the atmosphere is very cool. I'm not giving it 5 stars because it was a bit steep in price (I mean 13-14.00 per meal is quite high as it was only some bread and eggs with corned beef hash, and I thought the food was good but nothing I will order again. We may have to go back and try an omelet or the eggs benny"
4 star rating,"Great service, big fatty portions, and a great atmosphere. Highly recommend the duck confit hash and tech French toast. Yummmmmmm."
5 star rating,"The benny was good. Busy and cramped inside. Worth a try as the food is good, but service is slow and you will spend a full hour."
3 star rating,Coffee was great. Brunch was amazing!! Homemade soup and lemon curd French toast. Seriously worth the wait...which was almost too long.
4 star rating,"This place sits in a great location right in the central business district of Downtown Detroit and bleeds coolness and to add to all of that, the food is great! I enjoyed lunch here with a co-worker three days in a row. Be sure to try a cup of the cauliflower soup and the bacon parmesean truffle fries. I promise you won't be disappointed."
4 star rating,"Living in NYC for 15 years, I have eaten some outstanding meals, but THIS was hands down the best brunch I've ever had. Nothing more to say other than EAT HERE NOW!"
5 star rating,"Overall, I was very impressed with the food here. You're going to have to wait if you come here on a weekend, but it is worth it. I got the turkey sausage breakfast sandwich, which was really good. The sausage you could tell was homemade. The only reason I'm giving 4 stars is that they served it with a hamburger bun? I feel like there are so many other better ways to serve it (biscuit, pretzel bun, etc) that would accentuate the the sandwich. I would get again but see if I could get with a different bun."
4 star rating,Some of the best steak Benedict I've ever tried which means a lot since I'm from Chicago with all the good food.The bloodys and mimosas are to die for but the service needs major improvement.
4 star rating,"Popped in here for brunch during Movement Festival on a recommendation from a music business colleague.  After a short wait in the lobby, we were sat at the bar (we love to sit at the bar).  Food and service (although hipster) was outstanding and on point.  Highly recommended!"
5 star rating,"a really nice place to have a weekend brunch or breakfast. if you go, try the massive serving of pork rinds with a sweet and salty, sticky topping of white truffle oil. they have a great selection of dishes to pick from. i tried a southwestern benedict on biscuits that was spicy and delicious., they do serve alcohol, so that's nice for a brunch. get there early and expect to wait.love, juston"
4.5 star rating,"Located in the heart of Detroit, the ambiance is good, but usually there's a long wait time on weekends. We ended up waiting for an hour to get a table for 6. The beermosa drink was decent, but not a huge fan. The korean fries were as good as any regular fries but topped with meat and some kimhci type sauce.The chicken pesto sandwich was my favorite thing here."
3 star rating,The food here is quite delicious. I got the hash with Duck bop and a Bloody Mary. It was a very good meal. The service was good too.
5 star rating,"Hubby and I went there for early Sunday brunch.  I got the cheesesteak benedict (which was awesome) and he got the waffle.  The food is great, prices a bit on the higher end, but the service was horrible.  There were literally 4 tables in the place and we couldn't get our waiter to come back for coffee.  I had to get up and ask.  Then we couldn't get our bill.  That's why only 3 stars.  They were all behind the bar talking about how hungover they were from the night before.  Really unprofessional.  For that kind of $$ and great place I would have expected more from the staff."
3 star rating,"Went there after reading the rave reviews.  The Dime Store is not the best brunch in Detroit!  Toast wanna be.  Waffle was cold, omelet not desirable, potatoes average.  Mac and cheese was pitiful.  Crowded seating, small tables. Wish I went to Toast.  However, I will say the staff was friendly. The food will not bring me back."
1 star rating,Downtown Detroit needs more breakfast spots as you'll quickly notice as you walk past the few restaurants open on weekend mornings that are all crowded.Yay.What's not to like? Fun and friendly waitstaff. Well-made breakfast and brunch fare. Tasty Bloody Marys.Duck confit was tasty. Egg sandwiches with lox were tasty.
4 star rating,Amazing brunch. Their meals are always made fresh and potatoes are really good there. It can get pretty crowded and service takes a hit becuz of how busy they are. I would definable your recommend if your downtown Detroit and want some where good to eat and don't mind a crowd place. No matter what you order you will love it here.
5 star rating,This hidden gem is amazing for breakfast. The steak eggs Benedict was incredible. Top marks for the French toast also. Check it out!
5 star rating,"Great food, cool decor. We were in town visiting for a family reunion and found this place on Yelp. My parents loved it (and they are hard to please). My Dad had the burger- good, solid beef burger. My mom had the chicken salad and loved it. My husband had the duck and thought it was fantastic. I had the cod sandwich as a salad and it was great. It is a great option to have all sandwiches available as a salad. The service was also good, although our waitress was new, she tried her best. Bar selection was great too. We would definitely stop through again."
4 star rating,"LOOOOVE this menu... I've only been once and I had the Hangover Burger... It was AMAZING. 8 oz burger topped with pulled pork, a fried egg, and crispy leeks! I ordered it bunless and U still could only eat half. It was good but It needed more seasoning... For all that was going on the last thing I expected it to lack was flavor lol! Service is a bit slow and the wait is long...."
3 star rating,"Hour and a half wait??? Headed over to Grand Trunk and had amazing food, great Bloody Mary's, and excellent service in a Detroit landmark."
4.5 star rating,CRAZY busy during lunch time!! Go before noon or wait until after 12:45pm or 1pm. The cooks are great! Really friendly staff. Food is amazing as well. Korean Fries... duck sandwich.... nitro brew.... chili.... all good to try.
5 star rating,"Went there on a Wednesday around 2pm, the place was full. The place is not very big, i don't recommend if you are in a hurry or with a group more than 4. The two of us sat at the bar, it took about 45 mins to get our food. I ordered the sausage omelette, my brother got a hamburger and side salad. Average food with good service. The bartender that served us was very friendly and attending to refill our drinks and bring side condiments."
3 star rating,"Excellent menu! Creative breakfast and lunch entree's that I've never seen anywhere else. Everything that I've tried has been great. Need to arrive early if going for lunch, because seating is limited and it gets age at lunch crowd."
5 star rating,"I went here twice this weekend for breakfast and the food was great both times (especially the house-made sausage in the omelet)! I actually almost did not go back because the bartender the first time during brunch was terrible. He was a bigger guy with a beard...way too cool for school and really rude. He seems like he should work at a hipster dive bar where he can think he's way cooler than he actually is. High-five, bro.Thankfully, I decided to give it a second try on Tuesday, 5/5. I met a good friend of the owners (who was managing) and he was super nice. He saw that I was there a few minutes before they opened and let me hang out while the kitchen opened up. He was talkative and apologetic for the super cool bartender. Overall, I would absolutely recommend Dime Store to anyone looking for excellent food in the area; the ambiance is awesome, the prices are excellent, etc."
4 star rating,We had an excellent breakfast here. Our server recommended the specials and we were blown away by how good they were. I am definitely going back!
5 star rating,"Saturday morning brunch visit-worth the wait.  I had the truffle fries, which really made the meal special for me. Excellent service and what a gem to have in downtown Detroit."
5 star rating,"My wife and I are from Seattle, WA and I was in town for a workshop.  We wanted to get into downtown to eat dinner.  We saw this place got good reviews and we were not disappointed. We walked into a comfortable, clean restaurant.  Our server was friendly and we talked about local beer and wines; we settled on splitting a half order of Bacon, Parm & Truffle Fries, the Grilled Chicken Breast Salad, and a Duck Confit Reuben. I would guess that the entire menu is good. We were very pleased with our dishes, but that reuben was to die for, duck is rich but they put exactly the right amount on the sandwich.  We walked here from the People Mover and access was easy."
5 star rating,Detroit is alive and well!  Great food and friendly service in a packed space.  I will definitely return.  Everyone seems happy in here.  Malted waffle with fresh fruit was delicious.
5 star rating,"I don't think I ordered anything I didn't like from this place because everything I've tried so far has been beyond delicious. My friend and I love going here for lunch during the workweek. It's always bustling with people so you might have to wait a few minutes or so to get seated. Most recently, we ordered the brussels sprouts salad, the sweet poached pear salad, and a side of their house fries and they were, once again, so delicious. I'm a big fan of this place so definitely give this place a try!"
5 star rating,"We loved it!  The wait was long for Sunday brunch, but so totally worth it.  I recommend the benedicts or the omelette--but really the biggest problem was deciding what to have.  The service was GREAT despite the fact that the place was busy and tables were turning over quickly.  I love the casual atmosphere and friendly vibe--and, of course, the waffles."
4.5 star rating,Yes.  Best brunch in the city.  Beer-mosas and smoked salmon eggs benedict will re-arrange your views on life.
5 star rating,Pretty good food. Nice atmosphere but very loud. They could stand to install some acoustic tiles on the ceiling
4 star rating,I LOVE Dime Store! I keep looking for excuses/reasons to head downtown just to go back. I had the warm brussel sprouts salad with grilled chicken. It was absolutely amazing. It also has a great atmosphere. Such a cool addition to the Detroit food scene.
5 star rating,Great brunch/breakfast. It's insanely crowded on weekends so be prepared to wait. Friendly staff and  unique/tasty food. One of the best brunch spots in the metro area for sure.
4 star rating,"Food was definitely worth the wait, and there was quite a wait!  Everything was beautifully plated and delicious to eat.  Great location and service was friendly, efficient and hospitable.  Can't wait to go back."
5 star rating,"How can I say this? I love love love this place. The breakfast is amazing, the brunch menu is outstanding. The chef knows exactly what they're doing, the servers know exactly what they're doing, everyone knows what they're doing here! It's a really fun environment, I've never experienced a place like this. Cool concept. Keep up the good work."
5 star rating,"Yum, we love this brunch spot! We'd probably come more often if it wasn't downtown. The food is delicious, the Bloody Mary's tasted a little watered down."
4 star rating,"Great brunch spot in Detroit! The place was busy until close, so either get there early or expect a wait! We had the sausage hash and a breakfast sandwich with bacon of course. Service was great and food was outstanding!! Definitely recommend."
5 star rating,"Always fresh, always amazing service. Highly recommend the Dime Store for Sunday brunch or lunch with friends. The ambiance is sunny and open. The environment, food and service leave me feeling satisfied every time."
5 star rating,The dime store was terrific fast service polite food excellent my mother was very pleased with my choice only problem for most restaurant downtown Detroit the parking is horrible almost laughable smh... Would return for future food and service..
4.5 star rating,Food and service was awesome! I got the veggie hash and a mimosa and was not disappointed. Will be back!
5 star rating,Really good food and comfortable atmosphere. Just went with a recommendation and I was not disappointed! Friendly staff and quick service for a relaxing breakfast at 830 on a Thursday. Tried the sausage hash and it was great with a cup of tea!
5 star rating,"Dime Store is absolutely awesome, great staff, good happy hour prices and delicious food. Only thing sucks it's always busy during the lunch hours so we do carryouts and eat it at the office."
5 star rating,"VERY good!! I got the sausage hash and it was very delicious. This is a small place, so the wait can be a little long but it is worth it! The wait staff was super friendly and helpful. Very cool atmosphere and delicious food! Highly recommend!"
5 star rating,"Dime Store is a top quality restaurant that serves food in the traditional serving size manner.  You won't have to worry about sharing a small platter of three avocado crab cakes amongst four people at Dime Store.  At Dime Store, each person orders their own meal, a lost concept in the up and coming restaurant scene in Detroit.  The pork burger is by far the best pork burger I have had anywhere.  The truffle fries serve as a nice companion to any dish there.  I have tried most things on the menu and have never left disappointed.  The waiting staff is very nice and attentive.  The bartender, Big Mike, is also super friendly and has a decent beer list for a decent price.  I love Dime Store!"
