rating,review
4 star rating,"SO SO SO good. Came here for brunch and it was really great. We came on a week day so we were sat right away, I'd expect a wait for weekends though. I ordered the Duck Bop Hash and it was absolutely incredible. It was probably one of the best breakfast dishes I've ever had!! Service, and atmosphere were great as well. The only downside to our experience was that we were informed after we ordered our food that the building was going to have a fire drill and that we would have to evacuate for 45 minutes. The server asked us if we wanted to cancel our order and when we told him that we did our food was already up. So we had to scarf everything down super fast which was a little annoying.... other than that, everything was great!!"
4.5 star rating,"Stopped in while in Detroit on business, and now it's secured that I will come here for my remaining breakfasts on this trip. I had the Gobbler Benny (a special) and my partner had the Salmon Benny. The Gobbler Benny was awesome, considering I was in the mood for what was in it. The turkey sausage was just slightly over seasoned, and the cranberry sauce could have been lessened because it was overwhelming. But those are the nitpicks. The eggs were perfectly poached, the stuffing cake perfectly moist, and the hollandaise was top. I also had a chai latte that was a bit muted in flavor(too much milk) but overall it was warming.The service was a little slow here but it's to be expected. The volume of people coming in right at opening was crazy, and by 8:30am it was half full. Definitely get here early if you want to get in quick!"
5 star rating,"We were looking for breakfast or brunch options within walking distance of our hotel. Per yelp, we decided on Dime Store. This place is nothing like a store and very popular as well as busy! We had a 45 minute wait before being seated. The hostess was very nice so we didn't mind. Besides, I just had to see what the hype was about.  I was starving and didn't want to spend much time scouring the menu that I settled on the Belgium waffle, scrambled eggs with cheese and their house-made pork sausage. My friend settled on build your own omelette and potatoes. The waffle was lukewarm but tasty once I slathered it in their delicious syrup. It tasted like yummy cane syrup. My eggs were scrambled perfectly with the right amount of cheese. The sausage however I sent right back to the kitchen and replaced it with bacon. Something wasn't quite right with that sausage. My friend enjoyed her omelette but the potatoes not so much. Oh I forgot to mention the peach mimosa I ordered was delicious and refreshing. The service was great. I'd visit again if I happen to be in downtown Detroit again as long as there isn't a wait."
4 star rating,Went there for lunch - get their early otherwise the line goes out the door. It's a small place so seating can be tight. Food is worth it...I got the special which was corned beef and hash. Highly recommended!Go for the salad(s) with Salmon my co-worker got that it looked great.
4 star rating,"I am working in Sterling Heights and my brother in law is working in Dearborn. We had to find common ground. This was a great place to find that. Park in the building garage and they will validate! Our server was great, honestly. No frills and straight forward. I got the BLTE breakfast sandwich. It surprisingly comes with a side salad, which I thought was odd. I am happy it did though. Leafy greens and a lemony dressing. Perfect starter. The sandwich was good, as well. Dearborn Bacon was thick and the brioche was super soft. My BIL accidentally left his food, and as we were heading to the elevator, our server runs out with his food."
4 star rating,"I came here with my fiancé and buddy before a baseball game and was very satisfied with my meal and the service. It's inside of a building with a couple of businesses and you have to put in a reservation and can sit at one of the chairs or tables while you wait.Upon entering the place it can get a bit crowded; we were seated 4 people and I could definitely hear other tables conversations without trying. We sat down and our waiter was awesome when it came to his recommendations and getting us drinks on time. I started with an Irish Coffee (may as well pregame before a baseball game right?) and went with the duck Reuben. My girl got the BLTE and it was also delicious. My buddy's wife got a bulgoki sandwich and it was so good that that is what I'll be ordering next time I come back here. The French fries were also good.Good location, but can be a long wait; but overall worth it to check out as a good brunch spot."
4 star rating,Worth the hour and half wait! At least you can wait in a seated area in the Chrysler building's lobby.  The staff was very sweet and came over to us apologizing about the late being longer than stated. It was a nice for them to acknowledge it and come by. The vegetarian hash was the best I've had. Love the potato cubes. The bloody Mary's were great. Will definitely come back here. Bring a game to pass the time
5 star rating,"Amazingly good breakfast to be found in the heart of downtown Detroit.  Very small, need to have your party all together to be seated, and it felt crowded. But considering how fabulous the hash was I totally understand why! Delicious artisan coffee, and a crazy variety of options for breakfast.  I'll have to go. Ack to try more! The service was prompt, but because of the fact that they are small and need move people quickly, I felt a bit rushed.  Still, very good food and adoreable atmosphere make this a place I would go to again!"
4 star rating,I visited after seeing Dime Store at Yelpdetroit on instagram that they are announced #1 restaurant in Detroit. I and my fiancé are from a small city so we just don't like driving around big cities because of parking situation. But Dime Store provides very convenient parking garage (Financial district garage) for 2 hours. We got there and of course there was wait but table turnover is very fast so we only waited 15 mins. I liked the ambience of the restaurant and the server came to my table fast and often. And.... the food was very good. My fiancé got cheesesteak sandwich and he wished it was bigger and I do agree it was smaller portion. But my food was very good. Thank you YelpDetroit for sharing your best restaurant. And Dime Store for making good food!
4 star rating,"My husband and I love this place. Usually we get one savory dish and one sweet, but at Dime Store my cheesesteak Benny is all mine. We've always had friendly service and food has always been delicious. Chai lattes are good too."
5 star rating,"Had lunch here a few days ago.  If my memory is right, companion had the special which had poached eggs on top of stuffing on top of turkey sausage sitting in cranberry sauce.  Said it was delicious, but one of the poached eggs was a little undercooked (the white part).I went with a mushroom omelette, potatoes sans seasoning, multigrain bread, and a side of turkey sausage.  Delicious.4.5 stars, but rounding down for the egg.Not my first trip and won't be my last."
4.5 star rating,"Had a great experience at the dime store. Went on a Saturday morning around 10:30 and was seated very quickly. I loved their menu selections, there were multiple options that I wanted to try.....not to mention that everything that came out looked delicious. The food was fresh, flavorful and reasonably priced.I ordered a create your own omelette and the French toast. Both were really good but my French toast was lukewarm at best. Aside from that everything we ate was great. I really enjoyed the hashborwn as they were cooked perfectly (so many people fail here )Overall we had a great visit and will definitely be back again.I knocked down a star for the service (our waiter didn't refill waters, or coffee. We had to get up to grab our on salt and pepper) and also because our French toast was not fresh. I'd imagine the next visit could easily be 5star"
4 star rating,"I have been trying to get into Dime Store since the day they opened but every single time I'm here, they are packed with at least a 45 minute wait.Well today I was downtown at 3pm, kind of an off hour as Dime Store closes at 4pm. They were about 25% full with lots of open seats!! Today was my day!!I ordered Bacon Avocado Omelette, Rye Toast and they allowed a substitution of the best damn fruit bowl I've ever had at a restaurant in place of the potatoes. The omelette was outstanding, and the rye toast was fabulous too as it was served with homemade jam.Tom ordered Maple Honey Salmon Salad. He said he loved it! Just looking at it made me want to get it! The salmon looked amazing!!We love the ambiance, the decor and the music too! Can't wait to go back!"
5 star rating,"I went here with a friend on Sunday morning and wasn't disappointed. You're immediately welcomed by a cool atmosphere, (including the neon sign people talk about), and a courteous, energetic staff.We each started out with an Irish coffee, which was generously poured, which is to say it was great. It's served separate from the coffee, so that allows you to choose how to ration the two components. It's a true Irish coffee: it has whiskey in addition to a cream-based liqueur. I had two.For our first course we split the waffles and the French toast. I preferred the latter but both were good. The brioche used for the French toast has a slight crisp to the crust, and a mild sweetness that you can taste before adding any syrup. We both still drowned each plate in butter and syrup, though, just to be safe.We couldn't decide which of the eggs bennys to get, so we ended up ordering all three and sharing. This isn't a bad way to go for two people, because each order has two portioned halves. We couldn't decide if we liked the pork belly or cheese steak variety best, but both were good. I docked a star from this place, though, because the eggs on two out of three benny orders were cooked through, meaning they were overcooked. It didn't detract in a disastrous way, but I missed the running yolk. But notwithstanding that, they were all tasty and pretty, and the side salad that comes with them is simple yet elegant too.Our server was Christina and she was very nice and attentive. All of the staff seemed pretty laid back and happy to be working there, it was a positive environment. I think that I prefer Hudson Cafe in terms of breakfast places downtown, simply because their French toast blew my mind, but I will still definitely return to Dime Store."
4 star rating,This is my best place to eat brunch  the salmon benny is my fav!!!!! thanks Larry!!!!!! I have fantastic time every time i come in.
5 star rating,"The food at Dime Store is awesome - love this menu.I'm also a huge fan of the atmosphere and decor - it's a fun place for anyone looking for a good start to your day!One thing I wasn't a fan of is how tight the space is. Our table was inches away from the next table, and unless I'm purposely going to a restaurant with community tables (i.e. Gather, Frita Batidos) I typically expect to not be sitting on top of each other. It's also really popular for lunch, so beware of a wait! That being said, I'll definitely return again... still so many things on the menu I want to try!"
4 star rating,"I'm a foodie and I have tons of experience in eating (LOL). Just moved here from DC and we visited this place about a couple of months ago when looking for a place to stay. The food and service was impeccable so we were excited that we were going to live only a block away'ish from this place. We went back again and man...their food is just.very.yummy. It's super casual yet the food doesn't look or taste casual. It's super fresh and nicely put together. Man, what's up with that spicy Korean fries?!?! What?! Although it wasn't spicy at all to me, it was a nice blend of Korean bulgogi with some thousand island dressing-like sauce on top of yummy fries. It was delicioso!! I love this place! You can't make reservations so sometimes, you will have to wait for a long time. The place is small so I understand. We were there before 9am on Sunday so there wasn't any wait. However! After 9 seems to be when it starts to get much busier. My plan is to taste every single dish from this place. #foodiegoals May be it's not such a great thing that I live so close to the place! Thank God I love to workout too!!"
5 star rating,"This place definitely gets crowded for lunch during the week. If you're heading there for a lunch break during the workday I'd head there by 11:30 to avoid waiting- the place isn't very big. The place is always busy for brunch on the weekends too. It's a little pricey, but the food and service is always good. I usually get the salmon burger because I love lox."
5 star rating,Waiting time  is long and they do not have online reservations. Food is really good! Next Best brunch place in Detroit after Hudson Cafe .
4 star rating,"This is a great place for breakfast.  Freshly prepared and chef inspired cuisine for breakfast? I'm down. I have tried a several things which were all tasty. However, the most memorable item I have eaten was the bacon.  No kidding.  Thick cut and meaty Dearborn bacon.  Not some BS bacon layered with fat.  They can get pretty busy. I have always waited for a table. However, the wait is not usually more than 15 minutes.  There is tons of available parking if you know where to look.  Just go to the West side blocks off Woodward."
4 star rating,"Came here due to the ""hype"" and all the rave reviews. It was honestly SUCH a let down. To begin with, right as we sat down, we got an attitude from our server. We were ordering and we felt very rushed, as we ordered and were not given a chance to finish ordering. I understand this place is busy, but at the least, customers should not be rushed. We started off with hot chocolate and coffee. She never came to our table after dropping them there. They sat there the whole time, along with a container with sugar packets and container of creams (at a very, very tiny table, mind you). She never came by to clear anything out of our way. She brought our food out and squeezed the plates onto the table around all of the clutter. We simply and nicely asked if she can please remove the items, since there was not much room for our plates, at this point (which she should have done on her own). She responded ""um, okay"" and rolled her eyes. Although she was very rude, we still tipped her accordingly, out of respect. Food was not worth the hype, as well. Mac and cheese was roomtemperature (not warm and cheesy) not good (and I am a mac and cheese fanatic). The BLTE sandwich had absolutely no flavor, at all and barely any sauce - and you guessed it, when I asked for more, I got an attitude. Everything we ordered was very bland and flavorless. Even the breakfast potatoes! I felt like I was eating nothing. 1 star because the sausage hash was okay - was not filling or anything out of this world though and we noticed that the other servers/staff seemed nice (just not the one we ended up with). This place is overhyped and was not worth the hour drive or the $60 for a breakfast for two."
4.5 star rating,"1st.time here because of a Yelp recommendation. Ok place inside a office building. Very noisy food was good,first try it came out cold even after ordering ""The Special"" On a Saturday.After all good food great service if you want this type of location."
3 star rating,"This place never seizes to amaze me. I come here as often as I can and would drive past all the other spots to get to this one. Their specials menu is always in point and the staple meals are never not made right. I also love that this place sells beer and wine and also mimosas. You get the ultimate brunch package when visiting the dime store. If you go on the weekends, be prepared to wait a while before being seating if you come after 11 AM."
5 star rating,"Hands down one of the best brunch options in downtown Detroit. I've had the brunch here several times over the last few years, and the quality has not diminished. Be prepared to wait if you come at peak times because there are no call ahead reservations, but it's worth it."
5 star rating,"Handy tip :  Go at 2.30pm on a saturday. That's when their wait lines go away and you can get seated immediately! :)What we ate : I got the veggie hash with beets,sweet potato,potatoes and pumpkin squash. It was lightly flavored with some curry powder. Yummy with eggs. Portion size was quite big. Their jam was also great! My husband got the veggie burger. Patty was made out of barley. The whole burger was really soft and melted in the mouth. However, the patty did not have any special taste and was almost bland. Maybe we wont order this again. Great house cut fries and mayo. We are glad we tried it."
4 star rating,"This was my first time dining at this restaurant and I must say the food was absolutely delicious! I had an item that was on the specials menu the strawberry cheesecake waffle! I literally felt like I had a small Slice of Heaven! The mac and cheese with the brussel sprouts was also a winner! The waiter was lackluster,  but that did not take away my experience from the food! The Chrysler Building that the restaurant is located in is also a great spot for culture and architecture! I definitely plan on dining here again."
4 star rating,This place is incredible! Amazing salad sandwiches and fries. We were in town for a conference- came back two says in a row. Couldn't resist. Excellent food!
5 star rating,Interesting place very good service excellent foodWe've only ever had breakfast there but it's quite outstanding
4 star rating,"I went here with a friend for a lunch today. Very busy, very loud, and they pack in the customers so it's a little cramped. The service was good, our waitress was tentative and polite. The only thing is the reviews I've read hyped this place up. It's more or less a cool cafe or diner in the ""new"" downtown Detroit area.I had the cheesesteak eggs benny and she had the Duck Bop Hash. My food was ok but honestly nothing special. She enjoyed her food, maybe more than me. Overall it was cool but not worth the hassle of finding parking downtown nor to be in a cramped space."
3 star rating,"We spent a weekend in downtown Detroit and chose the Dime Store for our breakfast spot.  It is a quaint, fun little restaurant inside the Chrysler House building. The coffee is from Zingermans.  We had the bacon avocado omelette, the spicy belly benny (the jalapeño pesto is excellent on the benny), and house fries -which if you love truffle, were excellent. The only minor complaint, is the mimosa was heavy on the OJ. We can't wait to go back!"
5 star rating,"This is a must stop! We came in a rush before the Lions game, the food was delicious, healthy, and fast!"
4.5 star rating,Omg. That's all I can say. Amazing food. Outstanding experience. Was waiting 45 min for a table but it was worth it. Great service too
5 star rating,"Went for lunch today. It was pretty crowded, which I took as a good sign in Downtown Detroit on a Sunday.  I ordered the Spicy Korean fries, cauliflower Gruyere soup and their ""simple"" salad. The fries are out of sight!! I ordered the small...wish I'd gotten a large. The soup was a little bland for my taste. The name of the salad explains the salad. Note: there are other salads that sound much more flavorful. The menu is full of interesting sounding dishes...from pork belly to Korean beef sandwiches.I'll would definitely return."
4 star rating,"Sad you can't make reservations online, Yelp, etc. but this place is definitely worth the wait and hype. If I'm ever back in Detroit, I'm for sure making a stop here!  Shared everything with the spouse and we couldn't decide what to eat because everything in the pictures on Yelp looked so good!  Our eyes were definitely bigger than our stomachs but it was sooo worth it!"
5 star rating,"Dime Store consistently delivers interesting and delicious food. From traditional scrambled eggs and toast to variations of eggs Benedict, it brings diner cuisine to a gourmet level. Today's breakfast included eggnog French toast and pork belly jalapeño eggs Benedict. The French toast came with a ruminfused sauce and the spice was bold in the eggs Benedict."
5 star rating,"Just finished a 3 day trip to Detroit, 2 out of the 3 mornings we chose Dime Store for breakfast. You always know you are going to get great food here. We really enjoy sitting at the bar, love watching the process of the kitchen staff!"
5 star rating,"I had the duck bop hash, featuring duck confit, bulgogi, pickled vegetables, and sriracha... and boy, it was sooooo good!   A cool as hell vibe with really nice service. But I have to be honest...I disliked the coffee"
4 star rating,"The only reason I'm docking a star is because the counter space is cramped and someone had the bright idea to sit an older woman with a cane there and not offer her another option. The food was great! My husband and I shared a 1/2 order of the Korean fries. I built my own omelette and got the Belgium waffle. It was a hungry type of morning. Our waitress was great, despite being really busy. My omelette was too cheesy for my liking, but I could have ordered it with less cheese, luckily we had so much other food I left full.This place gets packed around noon, so come earlier if you can."
4 star rating,"Tiny cute and busy, awesome atmosphere . Next time I'll order something more extravagant, I only had some slam dunk good French toast and a bowl of fresh fruit. The Mimosa was a bit off but the bar had plenty other great choices. Great brunch...I'd definitely go back again *Super attentive service! Loved that about this spot"
4 star rating,Have only been once for breakfast. Good portions and great service.  Will have to go back to post a better review.
5 star rating,Definitely worth the wait! Went here for a Friday Lunch and there was a 35min wait for the little place. The place was definitely jammin' with all the nearby workers. They have lunch/brunch specials so look to the board to the daily special. The hostess was amazing and was able to accommodate our group of 4 that turned out to be 6 last minute -so def kudos to her for making it work! She was so polite and hardworking -truly amazing.Now onto the food: Locally sourced so you are supporting the city :) Menu looks simple but the tastes were amazing. I had the korean BBQ sandwich and bacon fries: Nice charred taste with the korean sweet bbq and the fries will satisfy your salt craving. Fries were not greasy or fatty tasting. The added Parmesan was perfect part to satisfy cheese craving. Bacon was thick cut so best to eat with forks. The Pork burger was prob the best part if you like spicy -looks fresh -tasted fresh as if they had marinated and mixed the meat patty just then and there as the spices all melted in  your mouth. It wasn't overly done so it was still juicy and  packs a kick once you start chewing! Went with a group to try everything between us. Def great to go with a small group or off hours with a big group cause the food was amazing. Parking is metered in the street or across the street in a structure. We lucked out with street parking.
4.5 star rating,"Korean bbq sandwich was okay would be a lot better if it was spicy, Brussels sprouts were really good, and fries were great as well"
4 star rating,Wow!  Dime store did not disappoint... Everything about our experience was great!  Service was friendly and efficient!  I had the Spicy Belly Benny and a side of breakfast potatoes... loved every bite and would highly recommend the Dime Store!  Can't wait to go back and try something else from their delicious menu!
5 star rating,Host said that wait time was 30 mins... ended up waiting for an hour! Food was worth it tho.
4 star rating,Best breakfast in Detroit.. hands down.  The duck bop hash is the jam.   Mimosas also aMazing!!
5 star rating,"Great atmosphere and awesome food. To be honest, the menu looked pretty typical for a brunch-like place, consisting of salads, sandwiches, eggs, French toast, fries, etc. But, wow! All of it was delicious. The fries with special mayos were out of this world. The French toast was done just right. My omelette was perfection. Worth the wait! A must eat place."
5 star rating,"One of my favorite brunch places in downtown. Although the wait to be seated took awhile, the service and food make up for it. The atmosphere is both high end and casual and the price isn't too bad. I had the duck bap and was pleasantly surprised at how well seasoned the potatoes were. The bulgogi fries were also a delicious treat. Although, I was a bit disappointed with the peach mimosa as it really just tasted like a regular mimosa. Either way, definitely recommend to brunch lovers in/visiting  Detroit."
