rating,review
5 star rating,"Even though they have a small dine in area, I've never seen anyone eat inside. Most people usually order to go. So if you're ordering to go, I would recommend calling ahead of time. Sometimes it's difficult to get through but keep trying, it'll save you time from having to wait if you order when you get to the restaurant. By the way they're not open on Sundays. So you'll have to make sure to stop by Monday through Saturday. I usually order a large portion. It's a lot of food for one person but it's only about a couple of bucks extra and I can save the rest for later. They have a small parking lot, so parking is tight. Now that I have that out of the way, My favorites items that I usually order are the jerk chicken and curry goat. You may want to order the mild jerk chicken as the spicy is a little too hot. The food here is amazing I can't wait to try everything else on the menu!"
4 star rating,"I can't believe I discovered this place so late in my life! I am only dramatic after eating Jerk chicken / Curry chicken with hot sauce! Filled with flavor and emotions . This is place is a Gem!Mi nuh have nutten fi complain bout, mi life irie."
5 star rating,Some of the best Jamaican food I had in a long time and I eat it many spots jerk chicken was great boneless like no other everything came together very great flavor was great the line was long but it was worth the wait if you want to eat here just called it in earlier.
5 star rating,This place is Amazing! If you're ever in the area and craving Jamaican food I highly recommend this place! I'm a sucker for plantains cooked the right way and they do! I normally pay a picture with my reviews but I was hungry and ate it all before I remembered. Sorry
4 star rating,I didn't know this place was so close to me so I checked it out. I ordered the oxtails and the Jerk Chicken dinners and 4 beef pies. I enjoyed the dinners but sent my beef pies home with my godmother by mistake. So will have to get them again the next time I'm there.I will try the pepper steaks because my husband may like those. He doesn't care for exotic foods if you can believe that.
4 star rating,Found this little gem while doing my Clinical fieldwork in Southfield.  Small place that is just carry out but man their jerk chicken packs some intense delicious flavor.  So good.  Can't wait to go back.
5 star rating,"I haven't been here in a few years and I went today and I am more than dissatisfied. I ordered the medium oxtails with rice, peas and plantains. The food was AWFUL! The oxtails were small pieces of fat NO meat and it's understandable the oxtails are sliced thin but this was almost nonexistent. The rice was over cooked and there was about five peas. I didn't eat anything else. I will NEVER return to this restaurant as the restaurant workers were unorganized and borderline rude plus when I returned to get my food one young lady didn't have on a hair net. Please do better I won't know if anything changes as I won't return and to add insult to injury this awful plate was $14. Not too high if the food was good but for bad oxtails and over cooked rice 14 is Wow! Instead of taking ANY responsibility for the experience there's an insult. The reply to my review was just as bad if not worst than the food and service. I'm happy I'd decided to not return to this establishment and I will make sure I tell everyone far and wide about my experience, also to advise them not to patronize this establishment. Good day!"
1 star rating,"I haven't been here in a few years and I went today and I am more than dissatisfied. I ordered the medium oxtails with rice, peas and plantains. The food was AWFUL! The oxtails were small pieces of fat NO meat and it's understandable the oxtails are sliced thin but this was almost nonexistent. The rice was over cooked and there was about five peas. I didn't eat anything else. I will NEVER return to this restaurant as the restaurant workers were unorganized and borderline rude plus when I returned to get my food one young lady didn't have on a hair net. Please do better I won't know if anything changes as I won't return and to add insult to injury this awful plate was $14. Not too high if the food was good but for bad oxtails and over cooked rice 14 is a robbery."
1 star rating,"I have to say that this place is absolutely  amazing!! If I had to describe it in one word..""DELICIOUS"" I can smell the aroma for miles!! The 1st time I experienced their food was due to me following the scent... the staff was great.. the facility was clean and my meal was absolutely Great! Stop in for a taste!! Its worth the short wait and very affordable!"
5 star rating,Our first visit to order the jerk chicken and bbq chicken meals were not flavorful as we expected. When bitten into the chicken it tasted like the chicken was not cooked all the way through. I didn't eat much but ate the red beans and rice. Could be more flavorful but that's just my preference. The plantains was ok. I'd try it again if the food was more flavorful than today. Better luck next time.
2 star rating,Very slow and do not follow the 5 person rule in the lobby!  I will never eat here again!
1 star rating,"Everyone was super nice and friendly. Very small waiting area, but I met a nice gentleman who had just come back from an annual trip to Jamaica, and wanted a try out a new Caribbean spot. I came here starving after a challenging day at work. Normally, I am a patient person, but I was hangry and saw the sign on the wall say that they don't serve fast food, but fresh to order. (The wait was only 15 min, but you know) Luckily, they have those flaky, beef patties ready to go at the counter and I wolfed one down while waiting for my goat curry.So worth the wait. That goat curry was tender and delicious. Pieces are cut small, with some bone in. I don't mind it at all, but good to know for people not used to eating goat. (I recently warned friends about the goat curry at another local ethnic restaurant, which includes skin and considerable fat. Not everyone wants THAT authentic of an experience:)I did not grow up eating this kind of food, but I can't wait to go back and get some more of that spicy curry. I love having leftovers, which I add extra vegetables and rice to, because the gravy is that good."
4 star rating,"This was my first time at Jamaican Pot! I walked in and immediately heard Bob Marley playing so I knew that I was in for a treat. I ordered the small portion of oxtails which includes rice, cabbage and plantains. The smaller portion was the perfect size for myself, I also grabbed an Jamaican Pineapple soda as well. The cashier advised me that it would be about 15 minutes for my order to come up. I used that time to visit the store next door for a bottle of water as well. The Jamaican Pot is essential a carry-out restaurant. Once making it home I dove into the food and was pleasantly surprised, the food was amazing and I will definitely be returning!"
4 star rating,"I was excited to try this place out as I have been craving jerk chicken for a while. We ordered pick up from here and it was pretty good. I have to say I never had jerk chicken prepared like this where it was cut up and boneless. I appreciated not getting my hands dirty, but missed eating it off the bone and took away from the authenticity. The rice was a bit wetter than I expected as well. The plantains were solid as was the cabbage. The rum cake was tasty as well. It was disappointing that they ran out of 3 desserts already when we called to place our order. The oxtail was ok as was the curry chicken. I would probably check out other Jamaican restaurants for comparison in the area to see what they are up against."
3 star rating,"My new authentic discovery in Detroit. Not much room to eat inside so basically a carry out place. I tried the jerk chicken, an all day $3.99 mini lunch combo made spicy and a $2 beef patty to put me over the $5 credit card minimum. I was very pleased. The chicken chunks were tender and blackened with earthy, bold Jamaican spices. Ordered spicy this time which packed a lot of heat. Will go for ""Jamaican hot"" next time where they put raw peppers in it. The pricing is all fair and most entrees come in a ""small"" size which is like a large lunch and a large size which is hungry man sized for dinner or shareable for 2 regular people appetites. On my lunch special the meat sat atop the starch, which was peas and rice (akin to Cajun style dirty rice). The vegetable was a handful of cabbage and a single slice of fried plantain (wish there were a few but the mini lunch sort of small samples all the meal components).So don't be afraid of 8 Mile! This place makes spicy, bold & authentic Jamaican food. Two thumbs up. Next on my list to try here is the beef oxtail meal and curry goat. Yum!!!"
5 star rating,"I was disappointed. The person taking our order was nice and food came out in a timely manner. I ordered small Ox tails, small Jerk The Jerk tasted like it had a slightly spicy BBQ sauce on the chicken. It's not chicken parts, it's chopped chicken which was very lacking, tasted nothing like jerk. I asked for Spicy, it was no where near spicy. The rice and peas were oily. The cabbage bland. The Ox tails were mediocre. But I don't need to return to the Jamaican Pot.  Caribbean Citchen is a much better option for Caribbean food, and I've only been there twice. So disappointed"
4 star rating,"Keep it going Jamaica pot. This is the only place I go to for jerk ckin, today I'm trying the stewed beef. I'm sure it's gonna be on point."
5 star rating,"This place never dissappoints,  i fet the jerk and curry ckn and of course cabbage. I love when its a lil crunchy;) yum,yum,yum.this is my go to place when im starving.im from ny and this is the closet to curry, goat, and jerk as you get.take it from me its good.i eat here at least 4 times or more amonth. and sometimes i want it twice a week.oh btw do u you brown stewed beef or chicken?"
5 star rating,Please bring The Jamaican Pot to the Eastside!!!  I had the Curry Goat and the Jerk Chicken Combo Plate and it was superb!!!  Very well worth the drive!!!  I can't say enough about this place!!
5 star rating,"Mannnnnnnnnn the jerk and curry chicken was amazing and got the hibiscus drink that's Michigan made. If you thought Detroit couldn't have a Jamaican restaurant, think again. Come here for your Jamaican food fix for sure!"
5 star rating,Food wasn't that good at all. There has to be atleast one good Jamaican spot in Detroit I just have yet to locate it...
1 star rating,"Place is so good. Spicy as hell, but damn the shrimp is delicious. Cost is def $$ though, worth every penny."
5 star rating,Ok so this was my first time here...and the Ashley..the girl who takes the order..was really nice and kind..she gave me a free sample of the meat. Which was very nice and I believe all restaurants  should do. She explained the food and origin and taste..she convinced me to try the ACKEE and salt fish..doesnt sound appealing but it turned out to be really good. I also ordered the jerk chicken..also the Plantas was the Best!!!! Omg the caramelized was on point...i definitely will be back....just like Ashley said I will be
5 star rating,Excellent jerk chicken jerk shrimp beef patties just don't order the curry goat unless you like bones cartilage and fat very disappointed and it took 45 minutes to complete my order!
3 star rating,"Came here basically on a Yelp recommendation and also the fact that my wife is half Jamaican and therefore a lover of Jamaican food. The menu is a good size (although bigger than most Jamaican places) and from the menu I went with the beef patty and the triple chicken dinner. The beef patty was really good and to me one of the better one I had (it's good, flaky, a nice spice to it as well). The triple chicken dinner was curry, jerk, and brown stew chicken over rice/beans with cabbage and plantain. The brown stew and jerk chicken was very good, curry was good but could of been spicer. Overall a very good shop if you ask me (this is a takeout place with about 2 tables) and I will be back for more."
4 star rating,"I love this place! I have never had a bad meal here.. the only reason I'm taking a star away is because they are usually out of cornbread!! Consistently!! & it breaks my heart.. no matter what time of day you go, cornbread is never in stock. I think they're just not making it, but idk why. Cornbread is the perfect accessory for these types of meals. Other than than, I have no complaints. The meat is always fresh, and seasoned well. The cabbage always has just the right amount of crunch. The servings are more than enough. This place is a hidden gem in the Motor City, and a must to go to!"
4 star rating,"I love Jamaican food. I love spicy food. The jerk chicken was so hot I couldn't even finish it. I will give this place another try but wow, too much."
4 star rating,"Small mom and pop type restaurant with great food located in a strip mall. AMAZING spicy jerk chicken! The ackee and saltfish was good, but I think I might had gotten too much saltfish since it was a little on the salty side... sad they were out of beef patties. Plantains were sweet and delicious. Definitely check this place out!"
4 star rating,Bob Marley stew looks like slush( not appealing) and tastes below average. Jerk chicken is not good either - too salty and charred. But the chicken is tender actually.Cashier was pleasant. Juice had too much sugar in it. Seems authentic Jamaican though.
2 star rating,"Update- This is not fake news and I would have thought my review would help you to improve. While I was waiting for my order the young lady taking the order was so ghetto that a couple who was there for the first time decided to leave. I wouldn't give your a second try after your response to my review. Additionally, whoever eats at your establishment doesn't know real Jamaican food because the taste of my rice and peas was clearly not Jamaican cuisine. This is my first time leaving a review on yelp but I thought this location was very unprofessional and the rice and peas were over cooked and unseasoned. I would not recommend this restaurant."
1 star rating,This is my first time leaving a review on yelp but I thought this location was very unprofessional and the rice and peas were over cooked and unseasoned. I would not recommend this restaurant.
1 star rating,"I have just recently returned from Jamaica and came upon The Jamaica Pot back here in Detroit, Michigan. OMG, the jerk chicken was better then what I had in Jamaica. Hands down this is the best Jamaican good I've had in the States so far."
5 star rating,"I can appreciate this kind of small business but for me, this place just didn't work out. I understand that the food is made to order but 45 mins is just too long to wait imo for OK Jerk & BBQ chicken. I just felt like the Jerk Chicken was missing that kick of spice I'm used to. The plantains were bomb, but other than that I think I'll skip this place in the future. Glad others like it and hope it sticks around because we need more small businesses in the neighborhood.Forgot to add, the beef patty was really good and if I came back it would be for a few of those! No wait and piping hot, A+."
3 star rating,"Great place, authentic Jamaican food is hard to find. Right here in the green mile easily accessible for north of 8 Mile and south. Great location, parking lot is full from the business they get. Not a long wait at all. Super kind and polite, very knowledgeable about the culture and cuisine. I will be back 100 modded was"
5 star rating,"Great place, authentic Jamaican food is hard to find. Right here in the green mile easily accessible for north of 8 Mile and south. Great location, parking lot is full from the business they get. Not a long wait at all. Super kind and polite, very knowledgeable about the culture and cuisine. I will be back 100 more times!"
5 star rating,"Not sure why they aren't answering the phone at the moment but, I have literally tried to call exactly 30 times and no answer...I pulled up to order in store just to find out that they don't have what I want, something I could have avoided if the phone was answered the food is good though"
3 star rating,They were out of every dessert on menu on a Tuesday... I ordered jerk shrimp the portions are small.. the little bit of cabbage I had was very undercooked... the rice was dry and bland so dry my 1 yr old nephew spit it out immediately... Very unimpressed.
2 star rating,"I am Jamaican-American. I rarely eat at Jamaican restaurants. I ordered curry goat w/rice & peas, cabbage, fried plantain, and 2 beef patties. The patties were good. The rice & peas were ok. The plantain had a horrible taste like rancid oil. The cabbage was good. The curry goat was not what I expected. In Jamaica, the goat is served in large braised hunks of tender meat. This was served chopped fine, like canned tuna. Very little actual goat meat. It was mostly bones, fat, cartilage, and tiny shreds of goat meat. When I eat curry goat, I want hunks, not splinters. Please change the frying oil. The horrible aftertaste is bad!"
3 star rating,"Some coworkers and I stopped in the Jamaican Pot for lunch. I ordered a beef patty, and the jerk chicken mini lunch (only $3.99!) and it included jerk chicken, rice and peas, and cabbage. Unfortunately, they didn't have the plantains ready, but gave extra cabbage to make up for it.I have to say, this is the best Jamaican food I've ever had. Even without the plantains, which I was kind of disappointed about not being able to try, the chicken is moist and spicy, perfectly flavored (not over-seasoned), the cabbage and rice pair fantastically with the chicken. I highly recommend it. Caribbean comfort food at its best. The beef patty was good to the last bite as well. I gobbled it up so fast, I could have probably eaten another! Delicious!The lady behind the counter is super friendly. There are signs posted that say they are NOT a fast food restaurant, that everything is cooked to order, so please be patient. I believe it. The quality of the food really shows in how everything is prepared, but we really didn't have to wait long. Totally worth the 7-10 minute wait. I'd give this place five stars if it wasn't for the unavailable plantains. Other than that I loved it!"
4 star rating,"One of my favorite spots, being Cuban I don't get a lot of island food when I'm Michigan, I used to eat here like every other day when they first opened and I lived in Michigan on Mark Twain. But I live in Toronto and am never really in the area however, today I was and everything was DELICIOUS AND FRESH AS USUAL, and just as I remember. The rice and peas and cabbage as well as the pea soup and coco bread (always fresh) was divine. I always enjoy these delightful meals. If you're wondering about the sizes, the small veggie is more than enough, they give heaping portions and it's not expensive at all. The Ginger Passion is my favorite and I would literally move in with this family, because next to my own family in Cuba this is the best food I have ever eaten!! Sorry I didn't take pics I ate it too fast..."
5 star rating,I've been to Jamaica and the jerk chicken is very similar to what they had in Jamaica. The potions are fairly balanced and the cake is delicious. My next mission is to try the red snapper
5 star rating,"I grew up around Puerto Rican cuisine which shares many similarities with Jamaican. One of the major ones is our love of plantains. The plantains here were some of the best I have had outside of a restaurant specializing in Puerto Rican food. I got the curry chicken lunch special which came with a hefty portion of rice, meat, plantains, and cabbage. I would recommend going for whatever dish you want. Nothing is bad here. I also got a beef patty which was amazing. Ate it too quickly for pics."
5 star rating,"So delicious. I had the BBQ chicken special. It comes with rice, fried plantains, and cabbage. The bbq sauce is spicy ( just the way I like it). The cabbage is lightly cooked but full of flavor, the plantains are yummmy and the rice has some beans in it. I recommend trying this spot out but call first because they are always busy and the wait is 15 to 20 mins."
5 star rating,"Yelp wants me to write a long review about this place but it's plain and simple: this place is top notch. Fast, friendly service and delicious food. I've tried a few things from here and was never disappointed."
5 star rating,"This place has some of the tastiest food I have ever had.  Their Triple Delight Chicken Combo meal is the best way to get a sample of several things at once.  Jerk Chicken, Brown Stew, BBQ, Curry Chicken are all excellent, so flavorful and all boneless to boot.  Pepper Steak, Oxtail, Curry Goat and their Beef Meat Pies too are all excellent. The rice, cabbage and plantains you get with each meal....oh my....I'm getting so fired up talking about all their wonderful items I gonna have to stop on the way home from work tonight and get a couple of Triple Delights to go.  I have been stopping here for three years now and There are only two problems with The Jamaican Pot, one is that it is really not a sit down restaurant but mostly a take out as there are only two tables inside, and the biggest problem is that they are not located Closer to my house near Roseville.  Thank God they are kinda sorta on my way home, in a round about way, that I don't mind going to when the cravings hit."
5 star rating,"Awesome, this is some of the most flavorful food in all of Metro Detroit ! The Jerk Chicken is fantastic.  They use boneless chicken and it comes in varying degrees of hotness from Mild to satisfy 1st timer's all the way to to Jamaican Hot for the Home-lander's.  The Triple Chicken Delight is a great way to try three different dishes all in one meal.  It's amazing how different each dish taste and yet all are absolutely delicious.  The rice & peas, plantains and cabbage that come with each meal are equally as good.  The Beef Patty's are simply the Best anywhere.  We have tried most everything and have never been disappointed.  Super Friendly staff and owners make you feel so welcome.  Pretty much just a carry-out place...Can't wait for them to someday open a second place over on the East Side of Town...maybe even a nice sit down restaurant...hopefully...But, until then, I will be back again and again...."
5 star rating,"A friend of mine's father is Jamaican. Meaning no insult but I prefer the Jamaican Pot. Fast service, friendly people, and great carryout. Had them 3 times in the past 5 months.Strong thumb up !!!!!"
4 star rating,"What a great surprise to find this place! As some of you may know, I started a lunch group called ""lunch around the world "" and we try a different cuisine each month. Jamaican food was on the July, 2015 itinerary...Eight of us showed up on a Wednesday at noon to try Jamaican cuisine. I had only called ahead a half hour beforehand to give them a heads up. I needn't have bothered, because they didn't change a thing and that's okay for the most part. Nearly all other customers had Jamaican accents so it was obvious we were in the right place. There were only three tiny tables with 2 chairs each in their small lobby area and certainly not a place you would stay intentionally to eat. But the food itself is absolutely delicious. I couldn't decide on the menu, so I ordered lunch portions of both jerk chicken and curried goat. Both came with a side of plantains and cabbage. I asked for spicy and although it was quite mild, the flavors were out of this world!!The medium jerk chicken order was $8.99 and the curried goat was $12.99. Considering the cost of goat, I don't think this was unreasonable. My coworkers tried various things and some were more creative than others. Everyone, and I mean everyone, enjoyed their lunch and would come back. The jerk chicken was a favorite and the Jamaican pepper steak was reportedly ""ok"" in comparison.I knocked them down from 5 stars due to the wait. It was about 20 mins or so. We'll try to call ahead next time. They take credit cards.I believe it was the owner who told us they have purchased the place next door and will be adding a dining area soon. If they get decent staff and make people feel comfortable, they're bound to do an awesome business.If you're looking for an authentic little restaurant or ""diamond in the rough"", this is it! It's a taste of authentic Jamaica right in Detroit. Try it! And watch for the new dining area coming soon. I'd come back just to try the plantains fresh...oh and for more jerk chicken!!"
4 star rating,"This is my first experience with Jamaican food.... and all i can say is shame one me! The food was delicious! The shrimp was tender and flavorful and the rice was amazing as well. I usually can't do spicy food, no spice at all I'm a pansy that gets heart burn really easily and i usually don't like the taste anyway, but this shrimp dish was so well prepared and flavorful that i found myself enjoying every morsel despite the heart burn thay i had to endure a little later, next time I'll make sure to tell them no spice,  hope it doesn't affect the flavor.The service was good, he took our orders with a huge smile on his face and took the time to explain the food to a novice like myself.The only reason this was not a five star experience was the atmosphere. It could use a good interior decorator and a good scrubbing. Overall, I was highly impressed with this place and they made a lover of Jamaican food out of me."
