rating,review
4 star rating,"I really hate leaving poor reviews but I'm really disappointed. The only reason that I'm giving this restaurant one star is because of the decent customer service. This is by far the worst Jamaican food I've had in my life. I'm from south Florida and we have ample Caribbean restaurants, unlike Detroit. I've tried this restaurant on two occasions. The first time I had oxtail, it was tough and bland. Since this place has such great reviews, I thought that maybe I just had a bad experience. Therefore, I decided to give this place a second try. This time, I got the jerk chicken, which was not jerk at all. Sides were also terrible. Sorry. This is not a good Jamaican food."
4 star rating,Amazing food at a very nominal prize ! Jerk chicken and the curry chicken were really tasty and the fried plantain and cabbage as sides were excellent too !
5 star rating,"The food is so good! Period. Beef Patty, Jerk Chicken, and Curry Chicken are a few of my favorites."
5 star rating,"The food is so good! Period. They have changed and no longer accepts debit cards which usually would push me away from a business. However, I will gladly come prepared to pay cash!!I have had the Jerk Chicken, Curry Chicken, Oxtails, and the curry goat!"
5 star rating,Good food good service good location. Was the first time I ate Jamaican cuisine. I was impressed.
5 star rating,"So good!! But a fair warning to the faint at heart, the spicy is very hot! One of my favorite to go spots in Detroit :)"
5 star rating,"So good!! But a fair warning to the faint at heart, the spicy is very hot! One of my favorite to go spots in Detroit :)"
5 star rating,Best made Jamaican food hands down! Always fresh made so expect a likkle wait.large  Spicy Jerk is my go to. And I get that side of my jerk. Chicken & Veggie Patties when available are Grrreat. Customer service is improving so I do not have any stress.
5 star rating,Friendly fast service and deliciously authentic food in a clean environment. It's mostly a take our place but they're also a couple places to sit and eat. They also sell alkalized water.
4 star rating,I've been using yelp for a while now but I just decided to make an account for the sole purpose of rating The Jamaican Pot. This place is incredible. I got a med jerk chicken for carry out and it was absolutely delicious. The cashier was a really nice guy and made a ton of great recommendations. I'll prob be here at least 3 times a week. Amazing.
5 star rating,"This is my very first review on Yelp, (although I've been a user for a couple of years ) I went to a Caribbean themed event last night at a cigar bar, that advertised that there would be a ""tasting of Jamaican food..."" My first thought was that it was going to be catered ""Jamaican inspired"" foolishness lol, so I didn't head straight to the buffet. Wrong move on my part. I finally headed over after overhearing that the food was ""So good!"" The first plate (yup 1st) was a small sampler of jerk chicken, plantains, cabbage & rice/beans, which was devoured in minutes. I waited a good & agonizing 15mins before I made my way back to the buffet for a more substantial tasting (#2), I didn't want to be viewed as the ""greedy one"" in this small gathering of people. By the third plate (YES 3rd! Don't judge me, judge ya mutha! ) I didn't GIVE A DAMN what they thought!! This food gave me LIFE! When the organizer announced that there was ""plenty of food"" and to ""eat up"", I swear I wanted to go another round, but sadly there was no way I could do it. It was in that moment I really wished I had ziploc bags in my purse smh Needless to say, I HIGHLY recommend The Jamaican Pot! And will be enjoying their food again very soon...like in the next hour, soon. Right after I hit ""Post"", I'm calling in my order!"
5 star rating,"Sweet god almighty, if you love Jamaican food, go here. If it's your first time trying Jamaican food, go here. If you are someone trying to convince someone how good Jamaican food is, go here. JUST GO HERE. The lady who helped us out at the register (it was our first time coming to this establishment) was so patient with us while we were ordering (we were crazy indecisive but we ended up getting a crazy amount of food any because WHY NOT), and everything was absolutely delicious. Their oxtail is great, their goat is G.O.A.T. and don't even get me started on their desserts. If you can't make up your mind, let me do it for you and just go here. Just go."
5 star rating,"First time having authentic Jamaican food.  The Jerk Chicken was absolutely delicious!  I tend to shy away from very spicy food but they ask what you prefer.... I got it ""mild"" and it was just the right amount of heat and was not too overwhelming.  It was a great pair with the rice and beans and cabbage.  I could eat the plantain's as a dish all by itself!  So good.  And if you like ginger...the Jamaican Ginger Beer (a non-alcoholic beverage) was worth trying.  I definitely recommend calling ahead if your doing takeout.  It is a fairly small place with little seating, so probably not a good place for a large group or dining in.  Will definitely be returning."
4 star rating,"This hole in the wall Jamaican spot is so satisfying with their homemade Caribbean comfort food. Their jerk chicken with rice/beans is out of this world, the fried plantains they serve alongside take away the zing of the spice with their sweetness. They make amazing beef patties too - the crust has some spice and the flavor of the tender beef inside is phenomenal - 2 will fill you up or have one as a snack/appetizer! My husband enjoys the beef oxtail meal, and he likes their cabbage. Their portions are also very generous which keeps us coming back for more!"
5 star rating,Good food good service good location. Was the first time I ate Jamaican cuisine. I was impressed.
5 star rating,"This is my first time at The Jamaican Pot.The girls working there were polite and friendly, the place was clean, and Jigsy King was playing.  I left good going in.The jerk chicken was very mild and did not taste authentic.  But you would probably have to have had jerk chicken from a vendor in the streets of Jamaica to realize this or spend most of your life in Jamaica and had a uncle that loved to cook.  Ahhhhh, the good ol' days!The curry chicken was mediocre, not authentic either.  Very disappointed.I shoulda just went to Rono's Caribbean Family Dining.Now they know how to jerk some chicken.So I noticed after I posted this review, that the receipt said ""mild"".  I didn't know I was getting mild, and wish they had mentioned that I had an option.Anyways, the jerk sauce DID NOT taste authentic even for mild."
3 star rating,"Awesome experience. Jerk chicken, bbq chicken, curry goat, curry chicken were all amazing! Try the bean soup!!! Ill definitely be coming back here"
5 star rating,"Usually when I want some jerk chicken, I go to Jamaican Fenton's. Didn't feel like making that commute today so I tried out the Jamaican Pot. I got the extra spicy jerk chicken, and man when I say the spice hit me hard, I am not exaggerating. The chicken was very moist, rice was flavorful, and then plantains were sweet and soft. 5 stars hands down. Prior to going, I checked other reviews and it was advised to order at least 30 minutes in advance which worked perfectly."
5 star rating,"At least I know the management here is legit. After writing my previous review, a member of management contacted me to let him know when I'll be in next. Just so they can be sure they have the chicken patties that I come there for. I gotta say, customer service like that is few and far between. It's service like that that drums up repeat business, which is key to a small business succeeding."
4 star rating,"I haven't had any of the entrees but the curry chicken patty and coco bread was spot on, just the right amount of spice. It made me feel like I was back home, I was getting nervous that Michigan didn't have any good Jamaican food places.Update: The food was good, but they never have any curry chicken patties. I've showed up a few times and they never have them, so I just started to save myself the gas and call ahead. They said that there's not really a demand for curry chicken patties, which I can understand. But I feel like they never have them when I visit/call, and they couldn't tell me when they would have them. I'm really happy I found a Jamaican place I love, but bummed that they never have the product I want to order."
3 star rating,"I haven't had any of the entrees but the curry chicken patty and coco bread was spot on, just the right amount of spice. It made me feel like I was back home, I was getting nervous that Michigan didn't have any good Jamaican food places.Update: The food was good, but they never have any curry chicken patties. I've showed up a few times and they never have them, so I just started to save myself the gas and call ahead. They said that there's not really a demand for curry chicken patties, which I can understand. But I feel like they never have them when I visit/call, and they couldn't tell me when they would have them. I'm really happy I found a Jamaican place I love, but bummed that they never have the product I want to order."
4 star rating,"I haven't had any of the entrees but the curry chicken patty and coco bread was spot on, just the right amount of spice. It made me feel like I was back home, I was getting nervous that Michigan didn't have any good Jamaican food places."
5 star rating,"The best Jamaican spot in Detroit. Amazing portion and even better, amazing food! This is the best take out place where you feel like you're getting a home cooked meal."
5 star rating,My first time eating Jamaican food and it was delicious!!!Also the staff was very nice!
5 star rating,"The food is delicious however they seem to always be slow and out of items in the beginning of the day. This is a definite sign of poor management and preparation in the restaurant business. I am guessing that the owners were told that they make delicious food and should open a restaurant without knowing how to run one efficiently/. Maybe they need to know that when you run a food business, it is impossible to make each order to order. Maybe they need to arrive earlier in the morning, cook large quantities, hold the food properly and serve it quickly. Business would triple if people knew you could get in and out in less than 10 minutes. Even when you call in an order and get a pickup time, it's never ready. They also need to make sure, regardless of how many pieces they sell of an item, to either have it or take it off the menu.  If you have time to wait and are willing to change your order because what you want isn't available, then I suggest to give it a try."
3 star rating,Delicious!! Oxtails were on point and the curry chicken was so good! Worth the 30 minute drive.
4 star rating,"Very impressed with my experience here. Small hole in the wall place. Very friendly staff. Had the jerk chicken lunch special and it hit the spot. Good portion, well balanced, not overpriced. I would come here again and recommend it to all. Very flavorful food!"
5 star rating,"Great service and quick if you call ahead. The mild bbq and jerk are good, but I think it would be more flavorful if you choose spicy. I will next time. Plantains, cabbage and beef patties are all excellent."
5 star rating,"Great Jamaican food every time.  Very quick and efficient service.  I would suggest checking out the menu and placing your order online.  It will be ready by the time you get there.  This is definitely a take out joint, with the requisite ""bullet-proof"" plexi-glass security infrastructure common in many Detroit neighborhood eateries. The food is excellent.  They have a wide variety of Jamaican foods, ad combination plates available to your liking.  Definitely worth the visit if you are into Jamaican."
4 star rating,"Well....it hurts me to post only a 3 star review, but out of the 3 meat combo plate I ordered, only 1 was good. I could've passed on the browned stewed and curry chicken, both were very bland. My favorite of the 3 was the jerk chicken. I personally appreciated how they cut up the chicken and its ready to eat, vs having it on the bone and you having to take it off. The veggies, rice and beef patty were good though, but because Ive had better, only 3 from me."
3 star rating,"Had been meaning to try this place for quite a while and am glad I did... as other reviews have said, there are two small tables but it is effectively carry out only and the food does take a while to be prepared... but well worth the wait... I tried the Jerk Shrimp at medium spice... serving size was easily enough for two... the rice, beans and pepper mixture was very tasty... the cabbage salad and plantains are sides included with the meal and also were good... give it a shot...you shouldn't be disappointed"
5 star rating,"So admittedly I have never had Jamaican food. My boyfriend and I were feeling adventurous so we decided to give this place a try after seeing good things about it online. We split a large meal with 3 different types of chicken, jerk, brown and barbecue. It also came with cabbage and plantains. I am sooo glad we gave this place shot, the food was excellent. Normally I'm not a fan of the flavor of cabbage but it was not as strong as I'm used to (and I mean that in a good way). I'm glad they have the option to choose different types of meat in a single dinner because we got to try different things without having to order too much. The whole point was to figure out which type of chicken would be our favorite...problem is it's all so good! We also decided to get some apple cobbler for dessert. Normally the crust is the worst part of the cobbler but even that was divine. Overall the meal was affordable, a large was enough to split between 2 people with leftovers. I would definitely recommend this place to others. So delicious!"
5 star rating,This place is Amazing! If you're ever in the area and craving Jamaican food I highly recommend this place! I'm a sucker for plantains cooked the right way and they do! I normally pay a picture with my reviews but I was hungry and ate it all before I remembered. Sorry
4 star rating,Decided to stop in because I had a taste for Jamaican food! I was not disappointed. The Jamaican Pot is strictly carry out. To avoid a wait order ahead! The jerk shrimp was very tasty (I ordered mild) by more sweet than spicy and served with a load of sautéed peppers. The oxtails were quite good and the curry goat was NOT just a bunch of bones. And the beef patties were nice and flaky!
4 star rating,"Call ahead! All food made to order, so if you don't be prepared to wait.  I waited 20 minutes, but didn't mind that day.I ordered the Jerk Chicken Large Lunch deal, spicy, and it came with a plantains, beans & rice (they call beans, peas!),  and a hot cabbage salad.  I also ordered a beef patty, a chicken curry patty, 2 Coco breads, and a  small rum cake.  This was more than enough to fill 2 people.  The Jerk Chicken was to die for!  It was spicy, and I usually like Thai food at a medium + level, and that is what I equate the spicy Jerk chicken to.  Very flavorful, and delicious.The plantains were good, not too sweet, starchy, or greasy.  The cabbage side was warm cabbage salad with a touche of acidity to it, and it went perfect with the Jerk chicken.The Patties I ordered just had meat in them, no vegetables, but were quite tasty.  I think I liked the beef over the chicken curry better.The Coco bread was a huge, soft, yeasty bun, that was a pleasure to eat.  A tad sweet, but I really dug how soft & spongy the bread was.The only item I didn't much care for was the rum cake.  It literally tasted like you were chewing dark rum.  There wasn't any sweetness to it at all, and after having spicy food, I love washing it down with something sweet.  Good thing the rest of the food was phe-nom!"
5 star rating,"This restaurant sits on the edge of Southfield (but is considered Detroit). Carryout type of place - just chairs and 1 table is you really want to sit here though.Paying for my food was a little tricky. I'm just under 5ft, and the counter is at 5ft haha. The lady behind the counter was sweet too; called me Bite-sized ;)Got the Curry chicken and jerk/bbq? chicken (I actually ordered a jerk shrimp and didn't check till I got home, -1 star). Tasted good regardless, but not what I ordered. They wrap the Togo boxes and give you silverware too. Paid ~$23.You pick your spicy level. (Got hot and it wasn't that spicy for reference). My favorites were the plantains and cabbage sides that come for free with the entree. The plantains were not dripping in grease (THANK YOU!). I'm willing to try them again, but I'll open and check my order before walking out.P.S. check out the song on their website. It's pretty sick ;)"
4 star rating,"Amazing food, and inexpensive. Be sure to call ahead if you don't want to wait about 15 minutes. It is definitely a carry-out place, all food is packaged to-go and there are just a couple tables. The staff was pretty friendly, though the table we sat at was a bit sticky, and some of the sodas we got weren't cold. Really tiny issues that won't keep me from coming back here again."
4 star rating,"Well Yelpers, this saga continues. This is the owner's latest chilling private response to my review:""Why don't you just move on, as no one but you cares about your ignorant comments. Now post this as well, as it is clear  to me just who you are.A child of SATAN."" Wow! Are you kidding me? WTF is wrong with this guy?"
1 star rating,"So, the owner is a little scary my fellow Yelpers. This is the message he sent to me privately: 6/28/18 @12:08pm""Your not worth another comment publicly, as it is obvious you are a hater and a liar to boot. As for that bless day I wish you, it would appear you enjoy to be a curse instead.""Then he posted this message the same day:6/28/2018  ""You say you can tell i am not in the restaurant that often. Seems to me, your review is suspect at best. Point out my F word, copy and paste it in another low IQ comment.I suspect you are most likely some flunky we just terminated, which is why you stated facts not in evidence to anyone but you.(how much time i spend in the restaurant).Now then, we can both have our own opinion..... but only one of us has the facts.""Wow. I saw a review he posted about Office Depot that was really disturbing. But he seems particularly nice to female Yelpers (with photos). I didn't think my review should have elicited such a hostile retort from an owner. There seems to be something amiss with this guy, he is taking this one bad review personally. I would hate to think of what would have occurred had I complained in person. What business owner can't take criticism? Do some quality control and move on, or don't. I can only tell what my experiences in his restaurant were. He seems like a bully."
1 star rating,"I can tell you are not actually in the restaurant that often and if you are, then the bad service happened on your watch. You can take that L and make corrections or stay in your feelings about my comment. You, and people like you, make it hard to ""shop my block"". BAD SERVICE it's almost always BAD SERVICE. If it's not BAD SERVICE then it's BAD ATTITUDE. Your employees managed to give BAD SERVICE but not BAD ATTITUDE, I guess they were saving that for you. Do better.  ""You have a blessed day"" as well, in the same way you meant it for me. P.S. What is the difference between me writing ""WTF"" and you writing ""the f word""? There are some semantics I'm missing here."
1 star rating,"Can you tell me why the food is never ready when you call it in? Today I called in 2 orders Jerk Chicken and Curried Goat. Came to pickup it up, all the way from Downtown mind you, and it still was not ready. The goat wasn't ready and they forgot to put in the other order. WTF? I'm voting them off the island the food is good but I don't have time for bad service anymore this has happened too many times with them. I mean literally something goes wrong with our order every time. We are DONE with them."
1 star rating,"Well my mom is from Jamaica born and raised.. I have eaten Jamaican food all my life. I tried the Jamaican pot when it first opened about maybe 5 years ago give or take.. and I didn't care for the food then. But I decided to give it another shot.. it's been a while. I ordered Jerk chicken, curry chicken and oxtails for my family. My opinion is that the food is unauthentic, has little to no flavor and after trying it again today it hasn't changed. I believe it's catering more to the American flavor vs. Authentic Jamaican. However I will say that the beef patty was tasty! If your looking for authentic Jamaican food.. this would not be it. It's Americanized...Jamaicans have bones in there food... not diced up chicken.. but hey I'm just one person. Try it for yourself."
1 star rating,"We have been coming here for years. They were one of the most decent Jamaican eatery's you can find in Detroit but honestly they've fallen off. I ordered the jerk chicken dinner extra spicy and this is the THIRD time they gave me barbecue chicken. I called back but of course no one answered. I never write poor reviews but this place is so inconsistent, I just couldn't help myself. Especially after the third time they messed up my order. Mind you I'm not even mad about the patty and koko bread that was missing from my order. So needless to say I will be looking for a new Jamaican spot."
3 star rating,"Usually don't give negative reviews, but I have to say coming from home West Indian, (Grenada )know what it supposed to taste like, real authentic Jamaican food, go to Caribbean Kitchen, that's some good food"
1 star rating,This place is absolutely wonderful. When you walk in it's so bright and upbeat and the staff is very friendly. The jerk chicken is to die for and the peach cobbler is one of the best I've had. They really do a great job. We will be back many times! Can't wait to try everything else!
5 star rating,"Moved back to Detroit from Chicago a few months ago, where I frequented Mr Brown's Lounge for their authentic Jamaican jerk wings. Thought I'd have a hard time finding something as good here in Detroit, but MAN was this stuff good. We ordered a large jerk chicken entree and it was more than enough for 2 people to share, plus it was the perfect amount of spice. Will definitely be coming back in the future."
5 star rating,"Just arrived from Miami, where there is alot  of jamacian influence. Hands down one of the best jamaican food i have ever had 5 stars all day everyday!."
5 star rating,This is the real deal. Just stopped by for my first time. The owners and staff were very friendly. The prices were very reasonable and they offered me samples.I just finished eating and I must say that I am content. This is the real Jamaican restaurant in Oakland County that you must visit.
5 star rating,"Good food made relatively quickly. I've been here three times and have had the jerk salmon, shrimp and chicken. My only gripe is the inability to reach someone when attempting to call my order ahead."
4 star rating,"Best Jamaican in the city hands down, only complaint is the portion of the side dishes (plantain and cabbage). A little more of both would make a world of difference in the experience"
4 star rating,"Best jerk chicken I've had from a restaurant for sure. I like that they are sauced unlike Fenton's which is a dry jrub The oxtails were good but a small portion size and mostly bone. I hate rice but the red beans and rice went well with the oxtail and jerk chicken. The cabbage was just ok. I wish they had more choices of sides other than automatically getting rice, cabbage and plantains. Ordered via doordash which didn't give options to change sides. Curry chicken is fire too"
4 star rating,"Best jerk chicken I've had from a restaurant for sure. I like that they are sauced unlike Fenton's which is a dry jerk rub. The oxtails were good but a small portion size and mostly bone. I hate rice but the red beans and rice went well with the oxtail and jerk chicken. The cabbage was just ok. I wish they had more choices of sides other than automatically getting rice, cabbage and plantains. Ordered via doordash which didn't give options to change sides."
4 star rating,"Had to go visit. Tried the escoveitch red snapper, rice and peas, plantain and cabbage.  Extremely flavorful and tasty."
5 star rating,"Went back again. Second day in a row cow foot, rice and peas, plaintain, and cabbage with a extra order of cabbage and Sorrell. Just as good as yesterday."
5 star rating,"I went to Jamaican Pot to try the beef patties 1 week ago. It was so good I had to go back today to try other things on the menu. Beef patties, oxtail and rice and peas was so tender and juicy. My husband couldn't get enough of it. The cabbage and fried plantain was cook to perfection. The jerk chicken was seasoned and right off the grill. Taste like I was eating in my mom's kitchen in Kingston Jamaica. The chicken soup was so good a meal by itself with bites of corn on the cob, dumplings and yam a authentic Jamaican soup. Go visit The Jamaican Pot. The food is cooked with love and Rose is the nicest, sweetest host you could talk. Good luck. I will be back"
5 star rating,"Amazing food, highly recommend this place. I met several Jamaicans in Miami throughout my years & they would all approve of this spot!!"
5 star rating,"Good authentic jamaican food, plantains come with every meal, spice level is on point! Easily can get in and out with call ins."
